============================================================
Re-scraping All FCA Fines Data (2013-2025)
============================================================

Will scrape years: 2013 to 2025
Total years: 13

âš ï¸  This will take approximately 1-2 hours to complete.

ğŸ•·ï¸ Starting FCA fines scraping from 2013 to 2025...
ğŸ“… Scraping year 2013...
   ğŸ“‹ Attempting structured scraping for 2013...
   ğŸ“‹ Trying FCA enforcement actions page for 2013...
   ğŸ” Accessing enforcement actions: https://www.fca.org.uk/news/news-stories/2013-fines
   ğŸ“Š Extracted 47 entries from table
Parsed UK date: 19/12/2013 â†’ 2013-12-19
   âœ… Processed: JLT Specialty Limited - Â£1,876,000
Parsed UK date: 17/12/2013 â†’ 2013-12-17
   âœ… Processed: Westwood Independent Financial Planners - Â£100,000
Parsed UK date: 11/12/2013 â†’ 2013-12-11
   âœ… Processed: Christopher Willford - Â£30,000
Parsed UK date: 11/12/2013 â†’ 2013-12-11
   âœ… Processed: Lloyds TSB Bank plc
			Bank of Scotland plc - Â£28,038,800
Parsed UK date: 25/11/2013 â†’ 2013-11-25
   âœ… Processed: SEI Investments (Europe) Limited - Â£900,200
Parsed UK date: 29/10/2013 â†’ 2013-10-29
   âœ… Processed: CoÃ¶peratieve Centrale Raiffeisen-Boerenleenbank B.A. (Rabobank) - Â£105,000,000
Parsed UK date: 24/10/2013 â†’ 2013-10-24
   âœ… Processed: Porta Verde Financial Services Limited - Â£25,000
Parsed UK date: 18/10/2013 â†’ 2013-10-18
   âœ… Processed: Mark Bentley-Leek - Â£525,000
Parsed UK date: 18/10/2013 â†’ 2013-10-18
   âœ… Processed: Mustafa Dervish - Â£360,000
Parsed UK date: 30/09/2013 â†’ 2013-09-30
   âœ… Processed: Alison Moran - Â£20,000
Parsed UK date: 25/09/2013 â†’ 2013-09-25
   âœ… Processed: ICAP Europe Limited - Â£14,000,000
Parsed UK date: 24/09/2013 â†’ 2013-09-24
   âœ… Processed: Clydesdale Bank PLC - Â£8,904,000
Parsed UK date: 23/08/2013 â†’ 2013-08-23
   âœ… Processed: Mr Andrew Jeffery - Â£150,000
Parsed UK date: 18/09/2013 â†’ 2013-09-18
   âœ… Processed: JP Morgan Chase Bank NA - Â£137,610,000
Parsed UK date: 12/09/2013 â†’ 2013-09-12
   âœ… Processed: AXA Wealth Services Ltd - Â£1,802,200
Parsed UK date: 02/09/2013 â†’ 2013-09-02
   âœ… Processed: Aberdeen Asset Managers Limited and
			Aberdeen Fund Management Limited - Â£7,192,500
Parsed UK date: 08/08/2013 â†’ 2013-08-08
   âœ… Processed: Guaranty Trust Bank (UK) Limited - Â£525,000
Parsed UK date: 06/08/2013 â†’ 2013-08-06
   âœ… Processed: Vandana Madhukar Parikh - Â£45,673
Parsed UK date: 26/07/2013 â†’ 2013-07-26
   âœ… Processed: John Douglas Leslie - Â£28,000
Parsed UK date: 19/07/2013 â†’ 2013-07-19
   âœ… Processed: Paul David Cable - Â£140,000
Parsed UK date: 16/07/2013 â†’ 2013-07-16
   âœ… Processed: Swinton Group Limited - Â£7,380,400
Parsed UK date: 16/07/2013 â†’ 2013-07-16
   âœ… Processed: The Royal Bank of Scotland plc and The Royal Bank of Scotland N.V - Â£5,620,300
Parsed UK date: 12/07/2013 â†’ 2013-07-12
   âœ… Processed: Jeffrey Simon Bennett - Â£28,000
Parsed UK date: 03/07/2013 â†’ 2013-07-03
   âœ… Processed: Michael Coscia - Â£597,993
Parsed UK date: 05/07/2013 â†’ 2013-07-05
   âœ… Processed: David Thomas Davis - Â£70,258
Parsed UK date: 01/07/2013 â†’ 2013-07-01
   âœ… Processed: Policy Administration Services Limited - Â£2,834,700
Parsed UK date: 19/06/2013 â†’ 2013-06-19
   âœ… Processed: Gurpreet Singh Chadda - Â£945,277
Parsed UK date: 05/06/2013 â†’ 2013-06-05
   âœ… Processed: Sesame Limited - Â£6,031,200
Parsed UK date: 05/06/2013 â†’ 2013-06-05
   âœ… Processed: Christopher John Riches - Â£63,000
Parsed UK date: 31/05/2013 â†’ 2013-05-31
   âœ… Processed: Xcap Securities Plc - Â£120,900
Parsed UK date: 10/05/2013 â†’ 2013-05-10
   âœ… Processed: J.P. Morgan International Bank Limited - Â£3,076,200
Parsed UK date: 29/04/2013 â†’ 2013-04-29
   âœ… Processed: Douglas Jones - Â£13,300
Parsed UK date: 28/03/2013 â†’ 2013-03-28
   âœ… Processed: EFG Private Bank - Â£4,200,000
Failed to parse date: "27/03/13", returning null
   âœ… Processed: Care Asset Management Limited - Â£56,000
Failed to parse date: "27/03/13", returning null
   âœ… Processed: The Prudential Assurance Company Limited - Â£16,000,000
Failed to parse date: "27/03/13", returning null
   âœ… Processed: Prudential plc - Â£14,000,000
Failed to parse date: "18/03/13", returning null
   âœ… Processed: Lamprell plc - Â£2,428,300
Failed to parse date: "15/02/13", returning null
   âœ… Processed: Lloyds TSB Bank Plc, Lloyds TSB Scotland Plc, and Bank of Scotland plc - Â£4,315,000
Failed to parse date: "14/02/13", returning null
   âœ… Processed: Nestor Healthcare Group Limited - Â£175,000
Failed to parse date: "08/02/13", returning null
   âœ… Processed: UBS AG - Â£9,450,000
Failed to parse date: "06/02/13", returning null
   âœ… Processed: The Royal Bank of Scotland plc - Â£87,500,000
Parsed UK date: 24/01/2013 â†’ 2013-01-24
   âœ… Processed: Stefan Chaligne - Â£900,000 (and Â disgorgement of â‚¬362,950)
Parsed UK date: 24/01/2013 â†’ 2013-01-24
   âœ… Processed: Patrick Sejean - Â£650,000
Parsed UK date: 15/01/2013 â†’ 2013-01-15
   âœ… Processed: Harbinder Panesar - Â£212,237
Parsed UK date: 07/01/2013 â†’ 2013-01-07
   âœ… Processed: Thomas Reeh - Â£10,000
Parsed UK date: 07/01/2013 â†’ 2013-01-07
   âœ… Processed: Christopher Ollerenshaw - Â£50,000
Parsed UK date: 04/01/2013 â†’ 2013-01-04
   âœ… Processed: Co-operative Bank plc - Â£113,300
   ğŸ“‹ Found 47 fines via structured page for 2013
Error saving fine: error: null value in column "date_issued" of relation "fca_fines" violates not-null constraint
    at /Users/adeomosanya/Documents/horizon-scanner-backend/node_modules/pg-pool/index.js:45:11
    at process.processTicksAndRejections (node:internal/process/task_queues:105:5)
    at async ServiceClass.saveFine (/Users/adeomosanya/Documents/horizon-scanner-backend/src/services/fcaFines/database.js:58:22)
    at async ServiceClass.scrapeYear (/Users/adeomosanya/Documents/horizon-scanner-backend/src/services/fcaFines/orchestrator.js:83:25)
    at async ServiceClass.startScraping (/Users/adeomosanya/Documents/horizon-scanner-backend/src/services/fcaFines/orchestrator.js:25:31)
    at async rescrapeAll (/Users/adeomosanya/Documents/horizon-scanner-backend/rescrape-all-fca-data.js:32:20) {
  length: 729,
  severity: 'ERROR',
  code: '23502',
  detail: 'Failing row contains (717, FCA-2013-034, null, Care Asset Management Limited, 56000.00, Â£56,000, GBP, For breach of rules in relation to its sale of products provided..., null, null, null, "[\\"Regulatory Breach\\"]", null, null, https://www.fca.org.uk/your-fca/documents/final-notices/2013/fsa..., null, null, 2013, 6, 2, null, null, f, f, f, null, null, {"firm":"Care Asset Management Limited","dateText":"27/03/13","a..., https://www.fca.org.uk/news/news-stories/2013-fines, 2025-11-03 13:42:59.656407, 2025-11-03 13:42:59.656407, f, pending).',
  hint: undefined,
  position: undefined,
  internalPosition: undefined,
  internalQuery: undefined,
  where: undefined,
  schema: 'public',
  table: 'fca_fines',
  column: 'date_issued',
  dataType: undefined,
  constraint: undefined,
  file: 'execMain.c',
  line: '1997',
  routine: 'ExecConstraints'
}
âŒ Error scraping year 2013: null value in column "date_issued" of relation "fca_fines" violates not-null constraint
ğŸ“… Scraping year 2014...
   ğŸ“‹ Attempting structured scraping for 2014...
   ğŸ“‹ Trying FCA enforcement actions page for 2014...
   ğŸ” Accessing enforcement actions: https://www.fca.org.uk/news/news-stories/2014-fines
   ğŸ“Š Extracted 40 entries from table
Parsed UK date: 20/11/2014 â†’ 2014-11-20
   âœ… Processed: Royal Bank of Scotland Plc, National Westminster Bank Plc and Ulster Bank Ltd - Â£42,000,000
Parsed UK date: 17/11/2014 â†’ 2014-11-17
   âœ… Processed: Chase de Vere Independent Financial Adviser Limited (Formerly AWD Chase de Vere Limited) - Â£560,000
Parsed UK date: 11/11/2014 â†’ 2014-11-11
   âœ… Processed: Citibank N.A. - Â£225,575,000
Parsed UK date: 11/11/2014 â†’ 2014-11-11
   âœ… Processed: HSBC Bank Plc - Â£216,363,000
Parsed UK date: 11/11/2014 â†’ 2014-11-11
   âœ… Processed: JPMorgan Chase Bank - Â£222,166,000
Parsed UK date: 11/11/2014 â†’ 2014-11-11
   âœ… Processed: The Royal Bank of Scotland Plc - Â£217,000,000
Parsed UK date: 11/11/2014 â†’ 2014-11-11
   âœ… Processed: UBS AG - Â£233,814,000
Parsed UK date: 05/11/2014 â†’ 2014-11-05
   âœ… Processed: Anthony Peter Clare - Â£208,600
Parsed UK date: 05/11/2014 â†’ 2014-11-05
   âœ… Processed: Nicholas Bowyer - Â£306,700
Parsed UK date: 05/11/2014 â†’ 2014-11-05
   âœ… Processed: Peter Joseph Halpin - Â£412,700
Parsed UK date: 29/10/2014 â†’ 2014-10-29
   âœ… Processed: Sesame Limited - Â£1,598,000
Parsed UK date: 28/10/2014 â†’ 2014-10-28
   âœ… Processed: Yorkshire Building Society - Â£4,135,600
Parsed UK date: 09/10/2014 â†’ 2014-10-09
   âœ… Processed: David Gillespie - Â£10,500
Parsed UK date: 09/10/2014 â†’ 2014-10-09
   âœ… Processed: David Welsby - Â£14,000
Parsed UK date: 23/09/2014 â†’ 2014-09-23
   âœ… Processed: Barclays Bank Plc - Â£37,745,000
Parsed UK date: 16/09/2014 â†’ 2014-09-16
   âœ… Processed: Peter Thomas Carron - Â£300,000
Parsed UK date: 29/08/2014 â†’ 2014-08-29
   âœ… Processed: Craig Stuart Cameron - Â£350,000
Parsed UK date: 27/08/2014 â†’ 2014-08-27
   âœ… Processed: The Royal Bank of Scotland plc and National Westminster Bank plc - Â£14,474,600
Parsed UK date: 21/08/2014 â†’ 2014-08-21
   âœ… Processed: Deutsche Bank AG - Â£4,718,800
Parsed UK date: 07/08/2014 â†’ 2014-08-07
   âœ… Processed: Stonebridge International Insurance Limited - Â£8,373,600
Parsed UK date: 28/07/2014 â†’ 2014-07-28
   âœ… Processed: Lloyds Bank plc and Bank of Scotland plc - Â£105,000,000
Parsed UK date: 22/07/2014 â†’ 2014-07-22
   âœ… Processed: Ian Charles Hannam - Â£450,000
Parsed UK date: 16/06/2014 â†’ 2014-06-16
   âœ… Processed: Credit Suisse International - Â£2,398,100
Parsed UK date: 16/06/2014 â†’ 2014-06-16
   âœ… Processed: Yorkshire Building Society - Â£1,429,000
Parsed UK date: 23/05/2014 â†’ 2014-05-23
   âœ… Processed: Barclays Bank PLC - Â£26,033,500
Parsed UK date: 23/05/2014 â†’ 2014-05-23
   âœ… Processed: Daniel James Plunkett - Â£95,600
Parsed UK date: 15/05/2014 â†’ 2014-05-15
   âœ… Processed: Martin Brokers (UK) Ltd (Martins) - Â£630,000
Parsed UK date: 28/04/2014 â†’ 2014-04-28
   âœ… Processed: Invesco Asset Management Limited Invesco Fund Managers Limited - Â£18,643,000
Parsed UK date: 31/03/2014 â†’ 2014-03-31
   âœ… Processed: David Lloyd Wren - Â£70,000
Parsed UK date: 27/03/2014 â†’ 2014-03-27
   âœ… Processed: Philip Eley - Â£7,200
Parsed UK date: 26/03/2014 â†’ 2014-03-26
   âœ… Processed: Santander plc - Â£12,377,800
Parsed UK date: 20/03/2014 â†’ 2014-03-20
   âœ… Processed: Mark Stevenson - Â£662,700
Parsed UK date: 19/03/2014 â†’ 2014-03-19
   âœ… Processed: Besso Limited - Â£315,000
Parsed UK date: 13/03/2014 â†’ 2014-03-13
   âœ… Processed: City & Provincial - Â£1,100
Parsed UK date: 26/02/2014 â†’ 2014-02-26
   âœ… Processed: Forex Capital Markets Limited (â€œFXCM Ltdâ€) & FXCM Securities Limited (â€œFXCM Securitiesâ€) (together â€œFXCM UKâ€) - Â£4,000,000
Parsed UK date: 12/02/2014 â†’ 2014-02-12
   âœ… Processed: HomeServe Membership Limited - Â£30,647,400
Parsed UK date: 30/01/2014 â†’ 2014-01-30
   âœ… Processed: State Street Bank Europe Ltd; and State Street Global Markets International Ltd - Â£22,885,000
Parsed UK date: 30/01/2014 â†’ 2014-01-30
   âœ… Processed: Ewan King - Â£19,900
Parsed UK date: 24/01/2014 â†’ 2014-01-24
   âœ… Processed: 7722656 Canada Inc formerly trading as Swift Trade Inc - Â£8,000,000
Parsed UK date: 23/01/2014 â†’ 2014-01-23
   âœ… Processed: Standard Bank PLC - Â£7,640,400
   ğŸ“‹ Found 40 fines via structured page for 2014
âœ… Year 2014 completed: 40 fines found, 40 new
ğŸ“… Scraping year 2015...
   ğŸ“‹ Attempting structured scraping for 2015...
   ğŸ“‹ Trying FCA enforcement actions page for 2015...
   ğŸ” Accessing enforcement actions: https://www.fca.org.uk/news/news-stories/2015-fines
   ğŸ“Š Extracted 40 entries from table
Parsed UK date: 17/12/2015 â†’ 2015-12-17
   âœ… Processed: Vroni Mavis O'Brien - Â£20,000
Parsed UK date: 15/12/2015 â†’ 2015-12-15
   âœ… Processed: Threadneedle Asset Management Limited - Â£6,038,504
Parsed UK date: 11/12/2015 â†’ 2015-12-11
   âœ… Processed: Paivi Katriina Grigg - Â£14,807
Parsed UK date: 26/11/2015 â†’ 2015-11-26
   âœ… Processed: Barclays Bank plc - Â£72,069,400
Parsed UK date: 17/11/2015 â†’ 2015-11-17
   âœ… Processed: Mothahir Miah - Â£139,000
Parsed UK date: 27/10/2015 â†’ 2015-10-27
   âœ… Processed: Andrew Peter Wilkins - Â£50,000
Parsed UK date: 23/10/2015 â†’ 2015-10-23
   âœ… Processed: Quick Purchase - Â£26,600
Parsed UK date: 30/09/2015 â†’ 2015-09-30
   âœ… Processed: John Joseph Financial Services Limited - Â£20,000
Parsed UK date: 22/09/2015 â†’ 2015-09-22
   âœ… Processed: Craig McNeil - Â£350,000
Parsed UK date: 10/09/2015 â†’ 2015-09-10
   âœ… Processed: Ralph Paul Whittington - Â£42,111
Parsed UK date: 13/08/2015 â†’ 2015-08-13
   âœ… Processed: Robert Ian Shaw - Â£165,900
Parsed UK date: 12/08/2015 â†’ 2015-08-12
   âœ… Processed: Da Vinci Invest Ltd - Â£1,460,000
Parsed UK date: 12/08/2015 â†’ 2015-08-12
   âœ… Processed: Mineworld Ltd - Â£5,000,000
Parsed UK date: 12/08/2015 â†’ 2015-08-12
   âœ… Processed: Gyorgy Szabolcs Brad - Â£290,000
Parsed UK date: 12/08/2015 â†’ 2015-08-12
   âœ… Processed: Szabolcs Banya - Â£410,000
Parsed UK date: 12/08/2015 â†’ 2015-08-12
   âœ… Processed: Tamas Pornye - Â£410,000
Parsed UK date: 17/06/2015 â†’ 2015-06-17
   âœ… Processed: Asia Resource Minerals plc (formerly Bumi plc) - Â£4,651,200
Parsed UK date: 05/06/2015 â†’ 2015-06-05
   âœ… Processed: Lloyds Bank plc, Bank of Scotland plc and Black Horse Limited (together Lloyds Banking Group "LBG") - Â£117,430,600
Parsed UK date: 20/05/2015 â†’ 2015-05-20
   âœ… Processed: Barclays Bank Plc - Â£284,432,000
Parsed UK date: 20/05/2015 â†’ 2015-05-20
   âœ… Processed: Paul Reynolds (formally known as Paul Brian Reynolds) - Â£290,344
Parsed UK date: 23/04/2015 â†’ 2015-04-23
   âœ… Processed: Deutsche Bank AG - Â£226,800,000
Parsed UK date: 23/04/2015 â†’ 2015-04-23
   âœ… Processed: Moorhouse Group Limited - Â£159,300
Parsed UK date: 22/04/2015 â†’ 2015-04-22
   âœ… Processed: Merrill Lynch International - Â£13,285,900
Parsed UK date: 15/04/2015 â†’ 2015-04-15
   âœ… Processed: The Bank of New York Mellon London Branch & The Bank of New York Mellon International Limited - Â£126,000,000
Parsed UK date: 14/04/2015 â†’ 2015-04-14
   âœ… Processed: Clydesdale Bank Plc - Â£20,678,300
Parsed UK date: 31/03/2015 â†’ 2015-03-31
   âœ… Processed: Robin Farrell - Â£650,000
Parsed UK date: 31/03/2015 â†’ 2015-03-31
   âœ… Processed: Robert Addison - Â£200,000
Parsed UK date: 30/03/2015 â†’ 2015-03-30
   âœ… Processed: Kenneth George Carver - Â£35,212
Parsed UK date: 20/03/2015 â†’ 2015-03-20
   âœ… Processed: Lloyd Arnold Pope - Â£93,800
Parsed UK date: 18/03/2015 â†’ 2015-03-18
   âœ… Processed: Alberto Micalizzi - Â£2,700,000
Parsed UK date: 13/03/2015 â†’ 2015-03-13
   âœ… Processed: Sam Thomas Kenny - Â£450,000
Parsed UK date: 13/03/2015 â†’ 2015-03-13
   âœ… Processed: Stephen Edward Bell - Â£33,800
Parsed UK date: 05/03/2015 â†’ 2015-03-05
   âœ… Processed: Bank of Beirut (UK) Ltd - Â£2,100,000
Parsed UK date: 05/03/2015 â†’ 2015-03-05
   âœ… Processed: Anthony Rendell Boyd Wills - Â£19,600
Parsed UK date: 05/03/2015 â†’ 2015-03-05
   âœ… Processed: Michael John Allin - Â£9,900
Parsed UK date: 24/02/2015 â†’ 2015-02-24
   âœ… Processed: Aviva Investors Global Services Limited - Â£17,607,000
Parsed UK date: 22/01/2015 â†’ 2015-01-22
   âœ… Processed: David Caplin - Â£210,000
Parsed UK date: 22/01/2015 â†’ 2015-01-22
   âœ… Processed: Jeremy Kraft - Â£105,000
Parsed UK date: 20/01/2015 â†’ 2015-01-20
   âœ… Processed: Reckitt Benckiser Group Plc - Â£539,800
Parsed UK date: 06/01/2015 â†’ 2015-01-06
   âœ… Processed: Execution Noble & Company Limited (ENCL) - Â£231,000
   ğŸ“‹ Found 40 fines via structured page for 2015
âœ… Year 2015 completed: 40 fines found, 40 new
ğŸ“… Scraping year 2016...
   ğŸ“‹ Attempting structured scraping for 2016...
   ğŸ“‹ Trying FCA enforcement actions page for 2016...
   ğŸ” Accessing enforcement actions: https://www.fca.org.uk/news/news-stories/2016-fines
   ğŸ“Š Extracted 23 entries from table
Parsed UK date: 28/11/2016 â†’ 2016-11-28
   âœ… Processed: Tariq Carrimjee - Â£89,004
Parsed UK date: 12/10/2016 â†’ 2016-10-12
   âœ… Processed: Steven Smith - Â£17,900
Parsed UK date: 12/10/2016 â†’ 2016-10-12
   âœ… Processed: SonaliÂ Bank (UK) Limited - Â£3,250,600
Parsed UK date: 05/10/2016 â†’ 2016-10-05
   âœ… Processed: Aviva Pension Trustees UK Limited and Aviva Wrap UK Limited - Â£8,246,800
Parsed UK date: 01/09/2016 â†’ 2016-09-01
   âœ… Processed: Elizabeth Anne Parry - Â£109,400
Parsed UK date: 09/08/2016 â†’ 2016-08-09
   âœ… Processed: CenkosÂ Securities Plc - Â£530,500
Parsed UK date: 15/07/2016 â†’ 2016-07-15
   âœ… Processed: Gavin Duncan Paul Breeze - Â£59,557
Parsed UK date: 13/07/2016 â†’ 2016-07-13
   âœ… Processed: Timothy Duncan Philip - Â£60,000
Parsed UK date: 13/07/2016 â†’ 2016-07-13
   âœ… Processed: Towergate Underwriting Group Limited - Â£2,632,000
Parsed UK date: 01/06/2016 â†’ 2016-06-01
   âœ… Processed: CT Capital Limited - Â£2,360,900
Parsed UK date: 13/05/2016 â†’ 2016-05-13
   âœ… Processed: Mark Samuel Taylor - Â£36,285
Parsed UK date: 09/05/2016 â†’ 2016-05-09
   âœ… Processed: Terence Andrew Joint - Â£10,000
Parsed UK date: 08/04/2016 â†’ 2016-04-08
   âœ… Processed: Timothy Alan Roberts - Â£450,000
Parsed UK date: 23/02/2016 â†’ 2016-02-23
   âœ… Processed: W H Ireland Limited - Â£1,200,000
Parsed UK date: 09/02/2016 â†’ 2016-02-09
   âœ… Processed: Achilles Othon Macris - Â£792,900
Parsed UK date: 01/02/2016 â†’ 2016-02-01
   âœ… Processed: Shay Jacob Reches - Â£1,050,000
Parsed UK date: 01/02/2016 â†’ 2016-02-01
   âœ… Processed: Shay Jacob Reches (additional penalty) - Â£13,130,000
Parsed UK date: 01/02/2016 â†’ 2016-02-01
   âœ… Processed: Colin J McIntosh - Â£51,600
Parsed UK date: 01/02/2016 â†’ 2016-02-01
   âœ… Processed: Robert John Bygrave - Â£37,400
Parsed UK date: 01/02/2016 â†’ 2016-02-01
   âœ… Processed: Andrea Christine Sadler - Â£18,700
Parsed UK date: 01/02/2016 â†’ 2016-02-01
   âœ… Processed: Wayne Anthony Redgrave - Â£38,600
Parsed UK date: 01/02/2016 â†’ 2016-02-01
   âœ… Processed: Millburn Insurance Company Limited (in administration) - Â£1,137,500
Parsed UK date: 01/02/2016 â†’ 2016-02-01
   âœ… Processed: Coverall Worldwide Ltd - Â£36,800
   ğŸ“‹ Found 23 fines via structured page for 2016
âœ… Year 2016 completed: 23 fines found, 23 new
ğŸ“… Scraping year 2017...
   ğŸ“‹ Attempting structured scraping for 2017...
   ğŸ“‹ Trying FCA enforcement actions page for 2017...
   ğŸ” Accessing enforcement actions: https://www.fca.org.uk/news/news-stories/2017-fines
   ğŸ“Š Extracted 13 entries from table
Parsed UK date: 14/12/2017 â†’ 2017-12-14
   âœ… Processed: Tejoori Limited - Â£70,000
Parsed UK date: 6/12/2017 â†’ 2017-12-06
   âœ… Processed: Bluefin Insurance Services - Â£4,023,800
Parsed UK date: 22/11/2017 â†’ 2017-11-22
   âœ… Processed: Paul Axel Walter - Â£60,090
Parsed UK date: 23/10/2017 â†’ 2017-10-23
   âœ… Processed: Merrill Lynch International - Â£34,524,000
Parsed UK date: 17/10/2017 â†’ 2017-10-17
   âœ… Processed: Rio Tinto Plc - Â£27,385,400
Parsed UK date: 12/10/2017 â†’ 2017-10-12
   âœ… Processed: Mrs Colette Chiesa - Â£50,000
Parsed UK date: 05/10/2017 â†’ 2017-10-05
   âœ… Processed: Clive John Rosier - Â£10,000
Parsed UK date: 19/09/2017 â†’ 2017-09-19
   âœ… Processed: Charles Palmer - Â£86,691
Parsed UK date: 14/07/2017 â†’ 2017-07-14
   âœ… Processed: David Samuel Watters - Â£75,000
Parsed UK date: 07/04/2017 â†’ 2017-04-07
   âœ… Processed: Lukhvir Thind - Â£105,000
Parsed UK date: 07/04/2017 â†’ 2017-04-07
   âœ… Processed: Niall Oâ€™Kelly - Â£11,900
Parsed UK date: 30/3/2017 â†’ 2017-03-30
   âœ… Processed: Christopher Niehaus - Â£37,198
Parsed UK date: 31/1/2017 â†’ 2017-01-31
   âœ… Processed: Deutsche Bank AG - Â£163,076,224
   ğŸ“‹ Found 13 fines via structured page for 2017
âœ… Year 2017 completed: 13 fines found, 13 new
ğŸ“… Scraping year 2018...
   ğŸ“‹ Attempting structured scraping for 2018...
   ğŸ“‹ Trying FCA enforcement actions page for 2018...
   ğŸ” Accessing enforcement actions: https://www.fca.org.uk/news/news-stories/2018-fines
   ğŸ“Š Extracted 15 entries from table
Parsed UK date: 19/12/2018 â†’ 2018-12-19
   âœ… Processed: Santander UK plc - Â£32,817,800
Parsed UK date: 14/12/2018 â†’ 2018-12-14
   âœ… Processed: Angela Burns - Â£20,000
Parsed UK date: 30/10/2018 â†’ 2018-10-30
   âœ… Processed: Liberty Mutual Insurance Europe SE - Â£5,280,800
Parsed UK date: 01/10/2018 â†’ 2018-10-01
   âœ… Processed: Tesco Personal Finance plc - Â£16,400,000
Parsed UK date: 20/09/2018 â†’ 2018-09-20
   âœ… Processed: Alistair Rae Burns - Â£60,000
Parsed UK date: 30/08/2018 â†’ 2018-08-30
   âœ… Processed: John Lawrence Radford - Â£468,600
Parsed UK date: 30/08/2018 â†’ 2018-08-30
   âœ… Processed: One Call Insurance Services Limited - Â£684,000
Parsed UK date: 08/06/2018 â†’ 2018-06-08
   âœ… Processed: Darren Colvin Cummings - Â£29,300
Parsed UK date: 06/06/2018 â†’ 2018-06-06
   âœ… Processed: Canara Bank - Â£896,100
Parsed UK date: 11/05/2018 â†’ 2018-05-11
   âœ… Processed: James Edward Staley - Â£321,200
Parsed UK date: 26/03/2018 â†’ 2018-03-26
   âœ… Processed: Alexander David Osborne Stuart - Â£34,000
Parsed UK date: 05/03/2018 â†’ 2018-03-05
   âœ… Processed: Guillaume Adolph - Â£180,000
Parsed UK date: 27/02/2018 â†’ 2018-02-27
   âœ… Processed: Vanquis Bank Limited - Â£1,976,000
Parsed UK date: 25/01/2018 â†’ 2018-01-25
   âœ… Processed: Interactive Brokers (UK) Limited - Â£1,049,412
Parsed UK date: 08/01/2018 â†’ 2018-01-08
   âœ… Processed: Neil Danziger - Â£250,000
   ğŸ“‹ Found 15 fines via structured page for 2018
âœ… Year 2018 completed: 15 fines found, 15 new
ğŸ“… Scraping year 2019...
   ğŸ“‹ Attempting structured scraping for 2019...
   ğŸ“‹ Trying FCA enforcement actions page for 2019...
   ğŸ” Accessing enforcement actions: https://www.fca.org.uk/news/news-stories/2019-fines
   ğŸ“Š Extracted 21 entries from table
Parsed UK date: 20/12/2019 â†’ 2019-12-20
   âœ… Processed: Kevin Gorman - Â£45,000
Parsed UK date: 17/12/2019 â†’ 2019-12-17
   âœ… Processed: Professional Personal Claims Limited - Â£70,000
Parsed UK date: 18/11/2019 â†’ 2019-11-18
   âœ… Processed: Henderson Investment Funds Limited - Â£1,867,900
Parsed UK date: 11/10/2019 â†’ 2019-10-11
   âœ… Processed: Tullet Prebon (Europe) Limited - Â£15,400,000
Parsed UK date: 30/09/2019 â†’ 2019-09-30
   âœ… Processed: The Prudential Assurance Company Limited - Â£23,875,000
Parsed UK date: 25/07/2019 â†’ 2019-07-25
   âœ… Processed: Cathay International Holding Limited - Â£411,000
Parsed UK date: 25/07/2019 â†’ 2019-07-25
   âœ… Processed: Jin-Yi Lee - Â£214,300
Parsed UK date: 25/07/2019 â†’ 2019-07-25
   âœ… Processed: Eric Ka Chi Siu - Â£40,200
Parsed UK date: 23/07/2019 â†’ 2019-07-23
   âœ… Processed: Standard Life Assurance Limited - Â£30,792,500
Parsed UK date: 21/06/2019 â†’ 2019-06-21
   âœ… Processed: Bank of Scotland plc - Â£45,500,000
Parsed UK date: 30/05/2019 â†’ 2019-05-30
   âœ… Processed: R.Raphael & Sons plc - Â£775,100
Parsed UK date: 29/04/2019 â†’ 2019-04-29
   âœ… Processed: Linear Investments Limited - Â£409,300
Parsed UK date: 09/04/2019 â†’ 2019-04-09
   âœ… Processed: Standard Chartered Bank - Â£102,163,200
Parsed UK date: 28/03/2019 â†’ 2019-03-28
   âœ… Processed: Goldman Sachs International - Â£34,344,700
Parsed UK date: 19/03/2019 â†’ 2019-03-19
   âœ… Processed: UBSÂ AG - Â£27,599,400
Parsed UK date: 13/03/2019 â†’ 2019-03-13
   âœ… Processed: The Carphone Warehouse - Â£29,107,600
Parsed UK date: 21/02/2019 â†’ 2019-02-21
   âœ… Processed: Hargreave Hale Limited - Â£306,300
Parsed UK date: 21/02/2019 â†’ 2019-02-21
   âœ… Processed: River & Mercantile Asset Management LLP - Â£108,600
Parsed UK date: 05/02/2019 â†’ 2019-02-05
   âœ… Processed: Paul Stephany - Â£32,200
Parsed UK date: 16/01/2019 â†’ 2019-01-16
   âœ… Processed: Stewart Owen Ford - Â£76,000,000
Parsed UK date: 16/01/2019 â†’ 2019-01-16
   âœ… Processed: Mark John Owen - Â£3,240,787
   ğŸ“‹ Found 21 fines via structured page for 2019
âœ… Year 2019 completed: 21 fines found, 21 new
ğŸ“… Scraping year 2020...
   ğŸ“‹ Attempting structured scraping for 2020...
   ğŸ“‹ Trying FCA enforcement actions page for 2020...
   ğŸ” Accessing enforcement actions: https://www.fca.org.uk/news/news-stories/2020-fines
   ğŸ“Š Extracted 11 entries from table
Parsed UK date: 21/12/2020 â†’ 2020-12-21
   âœ… Processed: Charles Schwab UK Limited - Â£8,963,200
Parsed UK date: 15/12/2020 â†’ 2020-12-15
   âœ… Processed: Corrado Abbattista - Â£100,000
Parsed UK date: 15/12/2020 â†’ 2020-12-15
   âœ… Processed: Barclays Bank UK PLC, Barclays Bank PLC, Clydesdale Financial Services Limited - Â£26,056,400
Parsed UK date: 10/12/2020 â†’ 2020-12-10
   âœ… Processed: LJ Financial Planning Ltd - Â£107,200
Parsed UK date: 23/11/2020 â†’ 2020-11-23
   âœ… Processed: TFS-ICAP Limited - Â£3,444,100
Parsed UK date: 22/10/2020 â†’ 2020-10-22
   âœ… Processed: Goldman Sachs International - Â£48,308,400
Parsed UK date: 14/10/2020 â†’ 2020-10-14
   âœ… Processed: Asia Research and Capital Management Ltd - Â£873,118
Parsed UK date: 17/06/2020 â†’ 2020-06-17
   âœ… Processed: Commerzbank AG - Â£37,805,400
Parsed UK date: 11/06/2020 â†’ 2020-06-11
   âœ… Processed: Lloyds Bank Plc, Bank of Scotland Plc and The Mortgage Business Plc - Â£64,046,800
Parsed UK date: 17/02/2020 â†’ 2020-02-17
   âœ… Processed: Moneybarn Limited - Â£2,774,400
Parsed UK date: 21/01/2020 â†’ 2020-01-21
   âœ… Processed: Hall and Hanley Limited (HHL) - Â£91,000
   ğŸ“‹ Found 11 fines via structured page for 2020
âœ… Year 2020 completed: 11 fines found, 11 new
ğŸ“… Scraping year 2021...
   ğŸ“‹ Attempting structured scraping for 2021...
   ğŸ“‹ Trying FCA enforcement actions page for 2021...
   ğŸ” Accessing enforcement actions: https://www.fca.org.uk/news/news-stories/2021-fines
   ğŸ“Š Extracted 10 entries from table
Parsed UK date: 17/12/2021 â†’ 2021-12-17
   âœ… Processed: HSBC Bank plc - Â£63,946,800
Parsed UK date: 13/12/2021 â†’ 2021-12-13
   âœ… Processed: National Westminster Bank Plc - Â£264,772,619.95
Parsed UK date: 12/11/2021 â†’ 2021-11-12
   âœ… Processed: Sunrise Brokers LLP - Â£642,400
Parsed UK date: 19/10/2021 â†’ 2021-10-19
   âœ… Processed: Credit Suisse International, Credit Suisse Securities (Europe) Ltd, and Credit Suisse AG - Â£147,190,200
Parsed UK date: 11/10/2021 â†’ 2021-10-11
   âœ… Processed: Omar Hussein - Â£116,000
Parsed UK date: 08/07/2021 â†’ 2021-07-08
   âœ… Processed: Lloyds Bank General Insurance Limited, St Andrewâ€™s Insurance Plc, Lloyds Bank Insurance Services Limited and Halifax General Insurance Services Limited - Â£90,688,400
Parsed UK date: 28/06/2021 â†’ 2021-06-28
   âœ… Processed: Crosfill and Archer Claims Limited - Â£110,000
Parsed UK date: 06/05/2021 â†’ 2021-05-06
   âœ… Processed: Sapien Capital Limited - Â£178,000
Parsed UK date: 15/04/2021 â†’ 2021-04-15
   âœ… Processed: Simon John Varley - Â£68,300
Parsed UK date: 04/03/2021 â†’ 2021-03-04
   âœ… Processed: Adrian Horn - Â£52,500
   ğŸ“‹ Found 10 fines via structured page for 2021
âœ… Year 2021 completed: 10 fines found, 10 new
ğŸ“… Scraping year 2022...
   ğŸ“‹ Attempting structured scraping for 2022...
   ğŸ“‹ Trying FCA enforcement actions page for 2022...
   ğŸ” Accessing enforcement actions: https://www.fca.org.uk/news/news-stories/2022-fines
   ğŸ“Š Extracted 25 entries from table
Parsed UK date: 20/12/2022 â†’ 2022-12-20
   âœ… Processed: TSB Bank Plc - Â£29,750,000
Parsed UK date: 12/12/2022 â†’ 2022-12-12
   âœ… Processed: Metro Bank Plc - Â£10,002,300
Parsed UK date: 08/12/2022 â†’ 2022-12-08
   âœ… Processed: Santander UK Plc - Â£107,793,300
Parsed UK date: 07/12/2022 â†’ 2022-12-07
   âœ… Processed: BGC Brokers LP, GFI Securities Limited and GFI Brokers Limited - Â£4,775,200
Parsed UK date: 01/12/2022 â†’ 2022-12-01
   âœ… Processed: Pembrokeshire Mortgage Centre Limited - Â£2,354,331
Failed to parse date: "12/10/22", returning null
   âœ… Processed: Gatehouse Bank plc - Â£1,584,100
Parsed UK date: 04/10/2022 â†’ 2022-10-04
   âœ… Processed: Sigma Broking Limited - Â£531,600
Parsed UK date: 04/10/2022 â†’ 2022-10-04
   âœ… Processed: Matthew Kent - Â£83,600
Parsed UK date: 04/10/2022 â†’ 2022-10-04
   âœ… Processed: Stephen Tomlin - Â£69,600
Parsed UK date: 04/10/2022 â†’ 2022-10-04
   âœ… Processed: Simon Tyson - Â£67,900
Parsed UK date: 19/08/2022 â†’ 2022-08-19
   âœ… Processed: Citigroup Global Markets Limited - Â£12,553,800
Parsed UK date: 05/08/2022 â†’ 2022-08-05
   âœ… Processed: Sir Christopher Gent - Â£80,000
Parsed UK date: 15/07/2022 â†’ 2022-07-15
   âœ… Processed: The TJM Partnership Limited (Formerly known as Neovision Global Capital Limited) (In Liquidation) - Â£2,038,700
Parsed UK date: 23/06/2022 â†’ 2022-06-23
   âœ… Processed: Ghana International Bank Plc - Â£5,829,900
Parsed UK date: 16/06/2022 â†’ 2022-06-16
   âœ… Processed: JLT Specialty Limited - Â£7,881,700
Parsed UK date: 09/06/2022 â†’ 2022-06-09
   âœ… Processed: TFS Loans Limited (in administration) - Â£811,900
Parsed UK date: 16/05/2022 â†’ 2022-05-16
   âœ… Processed: Andrew Mark Thomas Page - Â£361,071
Parsed UK date: 16/05/2022 â†’ 2022-05-16
   âœ… Processed: Aiden Henderson - Â£199,939
Parsed UK date: 16/05/2022 â†’ 2022-05-16
   âœ… Processed: Robert Ward - Â£88,100
Parsed UK date: 16/05/2022 â†’ 2022-05-16
   âœ… Processed: William Mark Tristan Freer (Tristan Freer) - Â£42,898
Parsed UK date: 16/05/2022 â†’ 2022-05-16
   âœ… Processed: Bank House Investment Management Limited (in liquidation) - Â£311,639
Parsed UK date: 29/03/2022 â†’ 2022-03-29
   âœ… Processed: Timothy Haywood - Â£230,037
Parsed UK date: 29/03/2022 â†’ 2022-03-29
   âœ… Processed: GAMÂ International - Â£9,103,523
Parsed UK date: 28/02/2022 â†’ 2022-02-28
   âœ… Processed: Barclays Bank plc - Â£783,800
Parsed UK date: 10/02/2022 â†’ 2022-02-10
   âœ… Processed: Julius Baer International Limited - Â£18,022,500
   ğŸ“‹ Found 25 fines via structured page for 2022
Error saving fine: error: null value in column "date_issued" of relation "fca_fines" violates not-null constraint
    at /Users/adeomosanya/Documents/horizon-scanner-backend/node_modules/pg-pool/index.js:45:11
    at process.processTicksAndRejections (node:internal/process/task_queues:105:5)
    at async ServiceClass.saveFine (/Users/adeomosanya/Documents/horizon-scanner-backend/src/services/fcaFines/database.js:58:22)
    at async ServiceClass.scrapeYear (/Users/adeomosanya/Documents/horizon-scanner-backend/src/services/fcaFines/orchestrator.js:83:25)
    at async ServiceClass.startScraping (/Users/adeomosanya/Documents/horizon-scanner-backend/src/services/fcaFines/orchestrator.js:25:31)
    at async rescrapeAll (/Users/adeomosanya/Documents/horizon-scanner-backend/rescrape-all-fca-data.js:32:20) {
  length: 747,
  severity: 'ERROR',
  code: '23502',
  detail: 'Failing row contains (896, FCA-2022-006, null, Gatehouse Bank plc, 1584100.00, Â£1,584,100, GBP, This Decision Notice refers to breaches of the Money Laundering ..., null, null, null, "[\\"Anti-Money Laundering\\",\\"Financial Crime\\"]", null, null, https://www.fca.org.uk/publication/decision-notices/gatehouse-ba..., null, null, 2022, 6, 2, null, null, f, f, f, null, null, {"firm":"Gatehouse Bank plc","dateText":"12/10/22","amountText":..., https://www.fca.org.uk/news/news-stories/2022-fines, 2025-11-03 13:43:56.517026, 2025-11-03 13:43:56.517026, f, pending).',
  hint: undefined,
  position: undefined,
  internalPosition: undefined,
  internalQuery: undefined,
  where: undefined,
  schema: 'public',
  table: 'fca_fines',
  column: 'date_issued',
  dataType: undefined,
  constraint: undefined,
  file: 'execMain.c',
  line: '1997',
  routine: 'ExecConstraints'
}
âŒ Error scraping year 2022: null value in column "date_issued" of relation "fca_fines" violates not-null constraint
ğŸ“… Scraping year 2023...
   ğŸ“‹ Attempting structured scraping for 2023...
   ğŸ“‹ Trying FCA enforcement actions page for 2023...
   ğŸ” Accessing enforcement actions: https://www.fca.org.uk/news/news-stories/2023-fines
   ğŸ“Š Extracted 12 entries from table
Parsed UK date: 30/11/2023 â†’ 2023-11-30
   âœ… Processed: Dollar East (International Travel & Money Transfer) Ltd - Â£3,600
Parsed UK date: 30/11/2023 â†’ 2023-11-30
   âœ… Processed: Hafiz Bros Travel & Money Transfer Limited - Â£11,200
Parsed UK date: 30/11/2023 â†’ 2023-11-30
   âœ… Processed: LCC Trans-Sending Limited - Â£139,500
Parsed UK date: 13/10/2023 â†’ 2023-10-13
   âœ… Processed: Equifax Limited - Â£11,164,400
Parsed UK date: 02/10/2023 â†’ 2023-10-02
   âœ… Processed: ADM Investor Services International Limited - Â£6,470,600
Parsed UK date: 28/09/2023 â†’ 2023-09-28
   âœ… Processed: Andrew John Deeney - Â£397,400
Parsed UK date: 13/07/2023 â†’ 2023-07-13
   âœ… Processed: Bastion Capital London Limited - Â£2,452,700
Parsed UK date: 04/07/2023 â†’ 2023-07-04
   âœ… Processed: Paul Steel - Â£3,694,400
Parsed UK date: 26/06/2023 â†’ 2023-06-26
   âœ… Processed: Mark Antony Abley - Â£106,100
Parsed UK date: 05/06/2023 â†’ 2023-06-05
   âœ… Processed: ED&F Man Capital Markets Ltd - Â£17,219,300
Parsed UK date: 11/01/2023 â†’ 2023-01-11
   âœ… Processed: Al Rayan Bank PLC - Â£4,023,600
Parsed UK date: 10/01/2023 â†’ 2023-01-10
   âœ… Processed: Guaranty Trust Bank (UK) Limited (GT Bank) - Â£7,671,800
   ğŸ“‹ Found 12 fines via structured page for 2023
âœ… Year 2023 completed: 12 fines found, 12 new
ğŸ“… Scraping year 2024...
   ğŸ“‹ Attempting structured scraping for 2024...
   ğŸ“‹ Trying FCA enforcement actions page for 2024...
   ğŸ” Accessing enforcement actions: https://www.fca.org.uk/news/news-stories/2024-fines
   ğŸ“Š Extracted 27 entries from table
Parsed UK date: 28/11/2024 â†’ 2024-11-28
   âœ… Processed: Philip Pryke - Â£1,377,968
Parsed UK date: 26/11/2024 â†’ 2024-11-26
   âœ… Processed: AndrÃ¡s SebÅ‘k - Â£123,500
Parsed UK date: 25/11/2024 â†’ 2024-11-25
   âœ… Processed: Barclays Bank plc - Â£10,000,000
Parsed UK date: 25/11/2024 â†’ 2024-11-25
   âœ… Processed: Barclays plc - Â£30,000,000
Parsed UK date: 18/11/2024 â†’ 2024-11-18
   âœ… Processed: Macquarie Bank Limited - London Branch - Â£13,031,400
Parsed UK date: 14/11/2024 â†’ 2024-11-14
   âœ… Processed: Craig Buchan - Â£6,037
Parsed UK date: 14/11/2024 â†’ 2024-11-14
   âœ… Processed: Martin Paul Cooke - Â£6,020
Parsed UK date: 12/11/2024 â†’ 2024-11-12
   âœ… Processed: Metro Bank plc - Â£16,675,200
Parsed UK date: 11/11/2024 â†’ 2024-11-11
   âœ… Processed: Leigh Mackey - Â£1,102,879
Parsed UK date: 27/10/2024 â†’ 2024-10-27
   âœ… Processed: Kristo KÃ¤Ã¤rmann - Â£350,000
Parsed UK date: 21/10/2024 â†’ 2024-10-21
   âœ… Processed: Volkswagen Financial Services (UK) Limited - Â£5,397,600
Parsed UK date: 9/10/2024 â†’ 2024-10-09
   âœ… Processed: TSB Bank plc - Â£10,910,500
Parsed UK date: 27/09/2024 â†’ 2024-09-27
   âœ… Processed: Starling Bank Limited - Â£28,959,426
Parsed UK date: 30/08/2024 â†’ 2024-08-30
   âœ… Processed: Alec John Cuthbert - Â£91,693
Parsed UK date: 16/08/2024 â†’ 2024-08-16
   âœ… Processed: PricewaterhouseCoopers LLP - Â£15,000,000
Parsed UK date: 14/08/2024 â†’ 2024-08-14
   âœ… Processed: Martin Christopher Sarl - Â£5,021
Parsed UK date: 9/08/2024 â†’ 2024-08-09
   âœ… Processed: Forex TB Limited - Â£276,100
Parsed UK date: 26/07/2024 â†’ 2024-07-26
   âœ… Processed: Anthony Dale Cuming - Â£1,691,259
Parsed UK date: 26/07/2024 â†’ 2024-07-26
   âœ… Processed: Steven Harbinder Singh Sahota - Â£1,782,343
Parsed UK date: 26/07/2024 â†’ 2024-07-26
   âœ… Processed: Kyle Anthony Jones - Â£443,153
Parsed UK date: 23/07/2024 â†’ 2024-07-23
   âœ… Processed: CB Payments Limited - Â£3,503,546
Parsed UK date: 19/06/2024 â†’ 2024-06-19
   âœ… Processed: Kulvir Virk - Â£215,500
Parsed UK date: 23/05/2024 â†’ 2024-05-23
   âœ… Processed: HSBC UK Bank plc, HSBC Bank plc, and Marks and Spencer Financial Services plc - Â£6,280,100
Parsed UK date: 17/05/2024 â†’ 2024-05-17
   âœ… Processed: Citigroup Global Markets Ltd - Â£27,766,200
Parsed UK date: 22/04/2024 â†’ 2024-04-22
   âœ… Processed: James William Edward Lewis - Â£120,300
Parsed UK date: 11/03/2024 â†’ 2024-03-11
   âœ… Processed: Inspirational Financial Management Ltd (in administration) - Â£897,840
Parsed UK date: 13/02/2024 â†’ 2024-02-13
   âœ… Processed: Floris Jakobus Huisamen - Â£31,800
   ğŸ“‹ Found 27 fines via structured page for 2024
Error saving fine: error: duplicate key value violates unique constraint "fca_fines_fine_reference_key"
    at /Users/adeomosanya/Documents/horizon-scanner-backend/node_modules/pg-pool/index.js:45:11
    at process.processTicksAndRejections (node:internal/process/task_queues:105:5)
    at async ServiceClass.saveFine (/Users/adeomosanya/Documents/horizon-scanner-backend/src/services/fcaFines/database.js:58:22)
    at async ServiceClass.scrapeYear (/Users/adeomosanya/Documents/horizon-scanner-backend/src/services/fcaFines/orchestrator.js:83:25)
    at async ServiceClass.startScraping (/Users/adeomosanya/Documents/horizon-scanner-backend/src/services/fcaFines/orchestrator.js:25:31)
    at async rescrapeAll (/Users/adeomosanya/Documents/horizon-scanner-backend/rescrape-all-fca-data.js:32:20) {
  length: 243,
  severity: 'ERROR',
  code: '23505',
  detail: 'Key (fine_reference)=(FCA-2024-001) already exists.',
  hint: undefined,
  position: undefined,
  internalPosition: undefined,
  internalQuery: undefined,
  where: undefined,
  schema: 'public',
  table: 'fca_fines',
  column: undefined,
  dataType: undefined,
  constraint: 'fca_fines_fine_reference_key',
  file: 'nbtinsert.c',
  line: '667',
  routine: '_bt_check_unique'
}
âŒ Error scraping year 2024: duplicate key value violates unique constraint "fca_fines_fine_reference_key"
ğŸ“… Scraping year 2025...
   ğŸ“‹ Attempting structured scraping for 2025...
   ğŸ“‹ Trying FCA enforcement actions page for 2025...
   ğŸ” Accessing enforcement actions: https://www.fca.org.uk/news/news-stories/2025-fines
   ğŸ“Š Extracted 18 entries from table
Parsed UK date: 5/08/2025 â†’ 2025-08-05
   âœ… Processed: Poojan Sheth - Â£57,600
Parsed UK date: 5/08/2025 â†’ 2025-08-05
   âœ… Processed: Jorge Lopez Gonzalez - Â£100,000
Parsed UK date: 5/08/2025 â†’ 2025-08-05
   âœ… Processed: Diego Urra - Â£223,400
Parsed UK date: 29/07/2025 â†’ 2025-07-29
   âœ… Processed: Sigma Broking Limited - Â£1,087,300
Parsed UK date: 25/07/2025 â†’ 2025-07-25
   âœ… Processed: Jean-Noel Alba - Â£1,049,500
Parsed UK date: 23/07/2025 â†’ 2025-07-23
   âœ… Processed: James Edward Staley - Â£1,107,306.92
Parsed UK date: 14/07/2025 â†’ 2025-07-14
   âœ… Processed: Barclays Bank UK plc - Â£3,093,600
Parsed UK date: 14/07/2025 â†’ 2025-07-14
   âœ… Processed: Barclays Bank plc - Â£39,314,700
Parsed UK date: 10/07/2025 â†’ 2025-07-10
   âœ… Processed: Markos Theodosi Markou - Â£10,000
Parsed UK date: 8/07/2025 â†’ 2025-07-08
   âœ… Processed: Monzo Bank Limited - Â£21,091,300
Parsed UK date: 2/07/2025 â†’ 2025-07-02
   âœ… Processed: Craig Donaldson - Â£167,325
Parsed UK date: 2/07/2025 â†’ 2025-07-02
   âœ… Processed: David Arden - Â£100,950
Parsed UK date: 30/05/2025 â†’ 2025-05-30
   âœ… Processed: Toni Fox - Â£567,584
Parsed UK date: 30/05/2025 â†’ 2025-05-30
   âœ… Processed: David Brian Price - Â£465,415
Parsed UK date: 20/03/2025 â†’ 2025-03-20
   âœ… Processed: The London Metal Exchange (RIE) - Â£9,245,900
Parsed UK date: 17/02/2025 â†’ 2025-02-17
   âœ… Processed: Mako Financial Markets Partnership LLP - Â£1,662,700
Parsed UK date: 27/01/2025 â†’ 2025-01-27
   âœ… Processed: Infinox Capital Limited - Â£99,200
Parsed UK date: 9/01/2025 â†’ 2025-01-09
   âœ… Processed: Arian Financial LLP - Â£288,962.53
   ğŸ“‹ Found 18 fines via structured page for 2025
âœ… Year 2025 completed: 18 fines found, 18 new
ğŸ‰ FCA fines scraping completed!
   ğŸ“Š Total fines processed: 203
   ğŸ†• New fines added: 203
   âš ï¸ Errors encountered: 3

============================================================
âœ… Re-scraping Complete!
============================================================

Next steps:
1. Verify data quality by checking sample records
2. Update trends table (may happen automatically)
3. Test the FCA Enforcement Widget on your website


Process completed.
