============================================================
Re-scraping All FCA Fines Data (2013-2025)
============================================================

Will scrape years: 2013 to 2025
Total years: 13

âš ï¸  This will take approximately 1-2 hours to complete.

ğŸ•·ï¸ Starting FCA fines scraping from 2013 to 2025...
ğŸ“… Scraping year 2013...
   ğŸ“‹ Attempting structured scraping for 2013...
   ğŸ“‹ Trying FCA enforcement actions page for 2013...
   ğŸ” Accessing enforcement actions: https://www.fca.org.uk/news/news-stories/2013-fines
   ğŸ“Š Extracted 47 entries from table
Parsed UK date: 19/12/2013 â†’ 2013-12-19
   âœ… Processed: JLT Specialty Limited - 19/12/2013
Parsed UK date: 17/12/2013 â†’ 2013-12-17
   âœ… Processed: Westwood Independent Financial Planners - 17/12/2013
Parsed UK date: 11/12/2013 â†’ 2013-12-11
   âœ… Processed: Christopher Willford - 11/12/2013
Parsed UK date: 11/12/2013 â†’ 2013-12-11
   âœ… Processed: Lloyds TSB Bank plc
			Bank of Scotland plc - 11/12/2013
Parsed UK date: 25/11/2013 â†’ 2013-11-25
   âœ… Processed: SEI Investments (Europe) Limited - 25/11/2013
Parsed UK date: 29/10/2013 â†’ 2013-10-29
   âœ… Processed: CoÃ¶peratieve Centrale Raiffeisen-Boerenleenbank B.A. (Rabobank) - 29/10/2013
Parsed UK date: 24/10/2013 â†’ 2013-10-24
   âœ… Processed: Porta Verde Financial Services Limited - 24/10/2013
Parsed UK date: 18/10/2013 â†’ 2013-10-18
   âœ… Processed: Mark Bentley-Leek - 18/10/2013
Parsed UK date: 18/10/2013 â†’ 2013-10-18
   âœ… Processed: Mustafa Dervish - 18/10/2013
Parsed UK date: 30/09/2013 â†’ 2013-09-30
   âœ… Processed: Alison Moran - 30/09/2013
Parsed UK date: 25/09/2013 â†’ 2013-09-25
   âœ… Processed: ICAP Europe Limited - 25/09/2013
Parsed UK date: 24/09/2013 â†’ 2013-09-24
   âœ… Processed: Clydesdale Bank PLC - 24/09/2013
Parsed UK date: 23/08/2013 â†’ 2013-08-23
   âœ… Processed: Mr Andrew Jeffery - 23/08/2013
Parsed UK date: 18/09/2013 â†’ 2013-09-18
   âœ… Processed: JP Morgan Chase Bank NA - 18/09/2013
Parsed UK date: 12/09/2013 â†’ 2013-09-12
   âœ… Processed: AXA Wealth Services Ltd - 12/09/2013
Parsed UK date: 02/09/2013 â†’ 2013-09-02
   âœ… Processed: Aberdeen Asset Managers Limited and
			Aberdeen Fund Management Limited - 02/09/2013
Parsed UK date: 08/08/2013 â†’ 2013-08-08
   âœ… Processed: Guaranty Trust Bank (UK) Limited - 08/08/2013
Parsed UK date: 06/08/2013 â†’ 2013-08-06
   âœ… Processed: Vandana Madhukar Parikh - 06/08/2013
Parsed UK date: 26/07/2013 â†’ 2013-07-26
   âœ… Processed: John Douglas Leslie - 26/07/2013
Parsed UK date: 19/07/2013 â†’ 2013-07-19
   âœ… Processed: Paul David Cable - 19/07/2013
Parsed UK date: 16/07/2013 â†’ 2013-07-16
   âœ… Processed: Swinton Group Limited - 16/07/2013
Parsed UK date: 16/07/2013 â†’ 2013-07-16
   âœ… Processed: The Royal Bank of Scotland plc and The Royal Bank of Scotland N.V - 16/07/2013
Parsed UK date: 12/07/2013 â†’ 2013-07-12
   âœ… Processed: Jeffrey Simon Bennett - 12/07/2013
Parsed UK date: 03/07/2013 â†’ 2013-07-03
   âœ… Processed: Michael Coscia - 03/07/2013
Parsed UK date: 05/07/2013 â†’ 2013-07-05
   âœ… Processed: David Thomas Davis - 05/07/2013
Parsed UK date: 01/07/2013 â†’ 2013-07-01
   âœ… Processed: Policy Administration Services Limited - 01/07/2013
Parsed UK date: 19/06/2013 â†’ 2013-06-19
   âœ… Processed: Gurpreet Singh Chadda - 19/06/2013
Parsed UK date: 05/06/2013 â†’ 2013-06-05
   âœ… Processed: Sesame Limited - 05/06/2013
Parsed UK date: 05/06/2013 â†’ 2013-06-05
   âœ… Processed: Christopher John Riches - 05/06/2013
Parsed UK date: 31/05/2013 â†’ 2013-05-31
   âœ… Processed: Xcap Securities Plc - 31/05/2013
Parsed UK date: 10/05/2013 â†’ 2013-05-10
   âœ… Processed: J.P. Morgan International Bank Limited - 10/05/2013
Parsed UK date: 29/04/2013 â†’ 2013-04-29
   âœ… Processed: Douglas Jones - 29/04/2013
Parsed UK date: 28/03/2013 â†’ 2013-03-28
   âœ… Processed: EFG Private Bank - 28/03/2013
No date text provided, using fallback: 2013-01-01
   âœ… Processed: Care Asset Management Limited - 27/03/13
No date text provided, using fallback: 2013-01-01
   âœ… Processed: The Prudential Assurance Company Limited - 27/03/13
No date text provided, using fallback: 2013-01-01
   âœ… Processed: Prudential plc - 27/03/13
No date text provided, using fallback: 2013-01-01
   âœ… Processed: Lamprell plc - 18/03/13
No date text provided, using fallback: 2013-01-01
   âœ… Processed: Lloyds TSB Bank Plc, Lloyds TSB Scotland Plc, and Bank of Scotland plc - 15/02/13
No date text provided, using fallback: 2013-01-01
   âœ… Processed: Nestor Healthcare Group Limited - 14/02/13
No date text provided, using fallback: 2013-01-01
   âœ… Processed: UBS AG - 08/02/13
No date text provided, using fallback: 2013-01-01
   âœ… Processed: The Royal Bank of Scotland plc - 06/02/13
Parsed UK date: 24/01/2013 â†’ 2013-01-24
   âœ… Processed: Stefan Chaligne - 24/01/2013
Parsed UK date: 24/01/2013 â†’ 2013-01-24
   âœ… Processed: Patrick Sejean - 24/01/2013
Parsed UK date: 15/01/2013 â†’ 2013-01-15
   âœ… Processed: Harbinder Panesar - 15/01/2013
Parsed UK date: 07/01/2013 â†’ 2013-01-07
   âœ… Processed: Thomas Reeh - 07/01/2013
Parsed UK date: 07/01/2013 â†’ 2013-01-07
   âœ… Processed: Christopher Ollerenshaw - 07/01/2013
Parsed UK date: 04/01/2013 â†’ 2013-01-04
   âœ… Processed: Co-operative Bank plc - 04/01/2013
   ğŸ“‹ Found 47 fines via structured page for 2013
Error saving fine: error: null value in column "date_issued" of relation "fca_fines" violates not-null constraint
    at /Users/adeomosanya/Documents/horizon-scanner-backend/node_modules/pg-pool/index.js:45:11
    at process.processTicksAndRejections (node:internal/process/task_queues:105:5)
    at async ServiceClass.saveFine (/Users/adeomosanya/Documents/horizon-scanner-backend/src/services/fcaFines/database.js:58:22)
    at async ServiceClass.scrapeYear (/Users/adeomosanya/Documents/horizon-scanner-backend/src/services/fcaFines/orchestrator.js:83:25)
    at async ServiceClass.startScraping (/Users/adeomosanya/Documents/horizon-scanner-backend/src/services/fcaFines/orchestrator.js:25:31)
    at async rescrapeAll (/Users/adeomosanya/Documents/horizon-scanner-backend/rescrape-all-fca-data.js:32:20) {
  length: 726,
  severity: 'ERROR',
  code: '23502',
  detail: 'Failing row contains (420, FCA-2013-034, null, Care Asset Management Limited, 27.00, 27/03/13, GBP, For breach of rules in relation to its sale of products provided..., null, null, null, "[\\"Regulatory Breach\\"]", null, null, https://www.fca.org.uk/your-fca/documents/final-notices/2013/fsa..., null, null, 2013, 6, 2, null, null, f, f, f, null, null, {"firm":"Care Asset Management Limited","dateText":"","amountTex..., https://www.fca.org.uk/news/news-stories/2013-fines, 2025-11-03 13:22:18.644525, 2025-11-03 13:22:18.644525, f, pending).',
  hint: undefined,
  position: undefined,
  internalPosition: undefined,
  internalQuery: undefined,
  where: undefined,
  schema: 'public',
  table: 'fca_fines',
  column: 'date_issued',
  dataType: undefined,
  constraint: undefined,
  file: 'execMain.c',
  line: '1997',
  routine: 'ExecConstraints'
}
âŒ Error scraping year 2013: null value in column "date_issued" of relation "fca_fines" violates not-null constraint
ğŸ“… Scraping year 2014...
   ğŸ“‹ Attempting structured scraping for 2014...
   ğŸ“‹ Trying FCA enforcement actions page for 2014...
   ğŸ” Accessing enforcement actions: https://www.fca.org.uk/news/news-stories/2014-fines
   ğŸ“Š Extracted 40 entries from table
Parsed UK date: 20/11/2014 â†’ 2014-11-20
   âœ… Processed: Royal Bank of Scotland Plc, National Westminster Bank Plc and Ulster Bank Ltd - 20/11/2014
Parsed UK date: 17/11/2014 â†’ 2014-11-17
   âœ… Processed: Chase de Vere Independent Financial Adviser Limited (Formerly AWD Chase de Vere Limited) - 17/11/2014
Parsed UK date: 11/11/2014 â†’ 2014-11-11
   âœ… Processed: Citibank N.A. - 11/11/2014
Parsed UK date: 11/11/2014 â†’ 2014-11-11
   âœ… Processed: HSBC Bank Plc - 11/11/2014
Parsed UK date: 11/11/2014 â†’ 2014-11-11
   âœ… Processed: JPMorgan Chase Bank - 11/11/2014
Parsed UK date: 11/11/2014 â†’ 2014-11-11
   âœ… Processed: The Royal Bank of Scotland Plc - 11/11/2014
Parsed UK date: 11/11/2014 â†’ 2014-11-11
   âœ… Processed: UBS AG - 11/11/2014
Parsed UK date: 05/11/2014 â†’ 2014-11-05
   âœ… Processed: Anthony Peter Clare - 05/11/2014
Parsed UK date: 05/11/2014 â†’ 2014-11-05
   âœ… Processed: Nicholas Bowyer - 05/11/2014
Parsed UK date: 05/11/2014 â†’ 2014-11-05
   âœ… Processed: Peter Joseph Halpin - 05/11/2014
Parsed UK date: 29/10/2014 â†’ 2014-10-29
   âœ… Processed: Sesame Limited - 29/10/2014
Parsed UK date: 28/10/2014 â†’ 2014-10-28
   âœ… Processed: Yorkshire Building Society - 28/10/2014
Parsed UK date: 09/10/2014 â†’ 2014-10-09
   âœ… Processed: David Gillespie - 09/10/2014
Parsed UK date: 09/10/2014 â†’ 2014-10-09
   âœ… Processed: David Welsby - 09/10/2014
Parsed UK date: 23/09/2014 â†’ 2014-09-23
   âœ… Processed: Barclays Bank Plc - 23/09/2014
Parsed UK date: 16/09/2014 â†’ 2014-09-16
   âœ… Processed: Peter Thomas Carron - 16/09/2014
Parsed UK date: 29/08/2014 â†’ 2014-08-29
   âœ… Processed: Craig Stuart Cameron - 29/08/2014
Parsed UK date: 27/08/2014 â†’ 2014-08-27
   âœ… Processed: The Royal Bank of Scotland plc and National Westminster Bank plc - 27/08/2014
Parsed UK date: 21/08/2014 â†’ 2014-08-21
   âœ… Processed: Deutsche Bank AG - 21/08/2014
Parsed UK date: 07/08/2014 â†’ 2014-08-07
   âœ… Processed: Stonebridge International Insurance Limited - 07/08/2014
Parsed UK date: 28/07/2014 â†’ 2014-07-28
   âœ… Processed: Lloyds Bank plc and Bank of Scotland plc - 28/07/2014
Parsed UK date: 22/07/2014 â†’ 2014-07-22
   âœ… Processed: Ian Charles Hannam - 22/07/2014
Parsed UK date: 16/06/2014 â†’ 2014-06-16
   âœ… Processed: Credit Suisse International - 16/06/2014
Parsed UK date: 16/06/2014 â†’ 2014-06-16
   âœ… Processed: Yorkshire Building Society - 16/06/2014
Parsed UK date: 23/05/2014 â†’ 2014-05-23
   âœ… Processed: Barclays Bank PLC - 23/05/2014
Parsed UK date: 23/05/2014 â†’ 2014-05-23
   âœ… Processed: Daniel James Plunkett - 23/05/2014
Parsed UK date: 15/05/2014 â†’ 2014-05-15
   âœ… Processed: Martin Brokers (UK) Ltd (Martins) - 15/05/2014
Parsed UK date: 28/04/2014 â†’ 2014-04-28
   âœ… Processed: Invesco Asset Management Limited Invesco Fund Managers Limited - 28/04/2014
Parsed UK date: 31/03/2014 â†’ 2014-03-31
   âœ… Processed: David Lloyd Wren - 31/03/2014
Parsed UK date: 27/03/2014 â†’ 2014-03-27
   âœ… Processed: Philip Eley - 27/03/2014
Parsed UK date: 26/03/2014 â†’ 2014-03-26
   âœ… Processed: Santander plc - 26/03/2014
Parsed UK date: 20/03/2014 â†’ 2014-03-20
   âœ… Processed: Mark Stevenson - 20/03/2014
Parsed UK date: 19/03/2014 â†’ 2014-03-19
   âœ… Processed: Besso Limited - 19/03/2014
Parsed UK date: 13/03/2014 â†’ 2014-03-13
   âœ… Processed: City & Provincial - 13/03/2014
Parsed UK date: 26/02/2014 â†’ 2014-02-26
   âœ… Processed: Forex Capital Markets Limited (â€œFXCM Ltdâ€) & FXCM Securities Limited (â€œFXCM Securitiesâ€) (together â€œFXCM UKâ€) - 26/02/2014
Parsed UK date: 12/02/2014 â†’ 2014-02-12
   âœ… Processed: HomeServe Membership Limited - 12/02/2014
Parsed UK date: 30/01/2014 â†’ 2014-01-30
   âœ… Processed: State Street Bank Europe Ltd; and State Street Global Markets International Ltd - 30/01/2014
Parsed UK date: 30/01/2014 â†’ 2014-01-30
   âœ… Processed: Ewan King - 30/01/2014
Parsed UK date: 24/01/2014 â†’ 2014-01-24
   âœ… Processed: 7722656 Canada Inc formerly trading as Swift Trade Inc - 24/01/2014
Parsed UK date: 23/01/2014 â†’ 2014-01-23
   âœ… Processed: Standard Bank PLC - 23/01/2014
   ğŸ“‹ Found 40 fines via structured page for 2014
âœ… Year 2014 completed: 40 fines found, 40 new
ğŸ“… Scraping year 2015...
   ğŸ“‹ Attempting structured scraping for 2015...
   ğŸ“‹ Trying FCA enforcement actions page for 2015...
   ğŸ” Accessing enforcement actions: https://www.fca.org.uk/news/news-stories/2015-fines
   ğŸ“Š Extracted 40 entries from table
Parsed UK date: 17/12/2015 â†’ 2015-12-17
   âœ… Processed: Vroni Mavis O'Brien - 17/12/2015
Parsed UK date: 15/12/2015 â†’ 2015-12-15
   âœ… Processed: Threadneedle Asset Management Limited - 15/12/2015
Parsed UK date: 11/12/2015 â†’ 2015-12-11
   âœ… Processed: Paivi Katriina Grigg - 11/12/2015
Parsed UK date: 26/11/2015 â†’ 2015-11-26
   âœ… Processed: Barclays Bank plc - 26/11/2015
Parsed UK date: 17/11/2015 â†’ 2015-11-17
   âœ… Processed: Mothahir Miah - 17/11/2015
Parsed UK date: 27/10/2015 â†’ 2015-10-27
   âœ… Processed: Andrew Peter Wilkins - 27/10/2015
Parsed UK date: 23/10/2015 â†’ 2015-10-23
   âœ… Processed: Quick Purchase - 23/10/2015
Parsed UK date: 30/09/2015 â†’ 2015-09-30
   âœ… Processed: John Joseph Financial Services Limited - 30/09/2015
Parsed UK date: 22/09/2015 â†’ 2015-09-22
   âœ… Processed: Craig McNeil - 22/09/2015
Parsed UK date: 10/09/2015 â†’ 2015-09-10
   âœ… Processed: Ralph Paul Whittington - 10/09/2015
Parsed UK date: 13/08/2015 â†’ 2015-08-13
   âœ… Processed: Robert Ian Shaw - 13/08/2015
Parsed UK date: 12/08/2015 â†’ 2015-08-12
   âœ… Processed: Da Vinci Invest Ltd - 12/08/2015
Parsed UK date: 12/08/2015 â†’ 2015-08-12
   âœ… Processed: Mineworld Ltd - 12/08/2015
Parsed UK date: 12/08/2015 â†’ 2015-08-12
   âœ… Processed: Gyorgy Szabolcs Brad - 12/08/2015
Parsed UK date: 12/08/2015 â†’ 2015-08-12
   âœ… Processed: Szabolcs Banya - 12/08/2015
Parsed UK date: 12/08/2015 â†’ 2015-08-12
   âœ… Processed: Tamas Pornye - 12/08/2015
Parsed UK date: 17/06/2015 â†’ 2015-06-17
   âœ… Processed: Asia Resource Minerals plc (formerly Bumi plc) - 17/06/2015
Parsed UK date: 05/06/2015 â†’ 2015-06-05
   âœ… Processed: Lloyds Bank plc, Bank of Scotland plc and Black Horse Limited (together Lloyds Banking Group "LBG") - 05/06/2015
Parsed UK date: 20/05/2015 â†’ 2015-05-20
   âœ… Processed: Barclays Bank Plc - 20/05/2015
Parsed UK date: 20/05/2015 â†’ 2015-05-20
   âœ… Processed: Paul Reynolds (formally known as Paul Brian Reynolds) - 20/05/2015
Parsed UK date: 23/04/2015 â†’ 2015-04-23
   âœ… Processed: Deutsche Bank AG - 23/04/2015
Parsed UK date: 23/04/2015 â†’ 2015-04-23
   âœ… Processed: Moorhouse Group Limited - 23/04/2015
Parsed UK date: 22/04/2015 â†’ 2015-04-22
   âœ… Processed: Merrill Lynch International - 22/04/2015
Parsed UK date: 15/04/2015 â†’ 2015-04-15
   âœ… Processed: The Bank of New York Mellon London Branch & The Bank of New York Mellon International Limited - 15/04/2015
Parsed UK date: 14/04/2015 â†’ 2015-04-14
   âœ… Processed: Clydesdale Bank Plc - 14/04/2015
Parsed UK date: 31/03/2015 â†’ 2015-03-31
   âœ… Processed: Robin Farrell - 31/03/2015
Parsed UK date: 31/03/2015 â†’ 2015-03-31
   âœ… Processed: Robert Addison - 31/03/2015
Parsed UK date: 30/03/2015 â†’ 2015-03-30
   âœ… Processed: Kenneth George Carver - 30/03/2015
Parsed UK date: 20/03/2015 â†’ 2015-03-20
   âœ… Processed: Lloyd Arnold Pope - 20/03/2015
Parsed UK date: 18/03/2015 â†’ 2015-03-18
   âœ… Processed: Alberto Micalizzi - 18/03/2015
Parsed UK date: 13/03/2015 â†’ 2015-03-13
   âœ… Processed: Sam Thomas Kenny - 13/03/2015
Parsed UK date: 13/03/2015 â†’ 2015-03-13
   âœ… Processed: Stephen Edward Bell - 13/03/2015
Parsed UK date: 05/03/2015 â†’ 2015-03-05
   âœ… Processed: Bank of Beirut (UK) Ltd - 05/03/2015
Parsed UK date: 05/03/2015 â†’ 2015-03-05
   âœ… Processed: Anthony Rendell Boyd Wills - 05/03/2015
Parsed UK date: 05/03/2015 â†’ 2015-03-05
   âœ… Processed: Michael John Allin - 05/03/2015
Parsed UK date: 24/02/2015 â†’ 2015-02-24
   âœ… Processed: Aviva Investors Global Services Limited - 24/02/2015
Parsed UK date: 22/01/2015 â†’ 2015-01-22
   âœ… Processed: David Caplin - 22/01/2015
Parsed UK date: 22/01/2015 â†’ 2015-01-22
   âœ… Processed: Jeremy Kraft - 22/01/2015
Parsed UK date: 20/01/2015 â†’ 2015-01-20
   âœ… Processed: Reckitt Benckiser Group Plc - 20/01/2015
Parsed UK date: 06/01/2015 â†’ 2015-01-06
   âœ… Processed: Execution Noble & Company Limited (ENCL) - 06/01/2015
   ğŸ“‹ Found 40 fines via structured page for 2015
âœ… Year 2015 completed: 40 fines found, 40 new
ğŸ“… Scraping year 2016...
   ğŸ“‹ Attempting structured scraping for 2016...
   ğŸ“‹ Trying FCA enforcement actions page for 2016...
   ğŸ” Accessing enforcement actions: https://www.fca.org.uk/news/news-stories/2016-fines
   ğŸ“Š Extracted 23 entries from table
Parsed UK date: 28/11/2016 â†’ 2016-11-28
   âœ… Processed: Tariq Carrimjee - 28/11/2016
Parsed UK date: 12/10/2016 â†’ 2016-10-12
   âœ… Processed: Steven Smith - 12/10/2016
Parsed UK date: 12/10/2016 â†’ 2016-10-12
   âœ… Processed: SonaliÂ Bank (UK) Limited - 12/10/2016
Parsed UK date: 05/10/2016 â†’ 2016-10-05
   âœ… Processed: Aviva Pension Trustees UK Limited and Aviva Wrap UK Limited - 05/10/2016
Parsed UK date: 01/09/2016 â†’ 2016-09-01
   âœ… Processed: Elizabeth Anne Parry - 01/09/2016
Parsed UK date: 09/08/2016 â†’ 2016-08-09
   âœ… Processed: CenkosÂ Securities Plc - 09/08/2016
Parsed UK date: 15/07/2016 â†’ 2016-07-15
   âœ… Processed: Gavin Duncan Paul Breeze - 15/07/2016
Parsed UK date: 13/07/2016 â†’ 2016-07-13
   âœ… Processed: Timothy Duncan Philip - 13/07/2016
Parsed UK date: 13/07/2016 â†’ 2016-07-13
   âœ… Processed: Towergate Underwriting Group Limited - 13/07/2016
Parsed UK date: 01/06/2016 â†’ 2016-06-01
   âœ… Processed: CT Capital Limited - 01/06/2016
Parsed UK date: 13/05/2016 â†’ 2016-05-13
   âœ… Processed: Mark Samuel Taylor - 13/05/2016
Parsed UK date: 09/05/2016 â†’ 2016-05-09
   âœ… Processed: Terence Andrew Joint - 09/05/2016
Parsed UK date: 08/04/2016 â†’ 2016-04-08
   âœ… Processed: Timothy Alan Roberts - 08/04/2016
Parsed UK date: 23/02/2016 â†’ 2016-02-23
   âœ… Processed: W H Ireland Limited - 23/02/2016
Parsed UK date: 09/02/2016 â†’ 2016-02-09
   âœ… Processed: Achilles Othon Macris - 09/02/2016
Parsed UK date: 01/02/2016 â†’ 2016-02-01
   âœ… Processed: Shay Jacob Reches - 01/02/2016
Parsed UK date: 01/02/2016 â†’ 2016-02-01
   âœ… Processed: Shay Jacob Reches (additional penalty) - 01/02/2016
Parsed UK date: 01/02/2016 â†’ 2016-02-01
   âœ… Processed: Colin J McIntosh - 01/02/2016
Parsed UK date: 01/02/2016 â†’ 2016-02-01
   âœ… Processed: Robert John Bygrave - 01/02/2016
Parsed UK date: 01/02/2016 â†’ 2016-02-01
   âœ… Processed: Andrea Christine Sadler - 01/02/2016
Parsed UK date: 01/02/2016 â†’ 2016-02-01
   âœ… Processed: Wayne Anthony Redgrave - 01/02/2016
Parsed UK date: 01/02/2016 â†’ 2016-02-01
   âœ… Processed: Millburn Insurance Company Limited (in administration) - 01/02/2016
Parsed UK date: 01/02/2016 â†’ 2016-02-01
   âœ… Processed: Coverall Worldwide Ltd - 01/02/2016
   ğŸ“‹ Found 23 fines via structured page for 2016
âœ… Year 2016 completed: 23 fines found, 23 new
ğŸ“… Scraping year 2017...
   ğŸ“‹ Attempting structured scraping for 2017...
   ğŸ“‹ Trying FCA enforcement actions page for 2017...
   ğŸ” Accessing enforcement actions: https://www.fca.org.uk/news/news-stories/2017-fines
   ğŸ“Š Extracted 13 entries from table
Parsed UK date: 14/12/2017 â†’ 2017-12-14
   âœ… Processed: Tejoori Limited - 14/12/2017
Parsed UK date: 6/12/2017 â†’ 2017-12-06
   âœ… Processed: Bluefin Insurance Services - 6/12/2017
Parsed UK date: 22/11/2017 â†’ 2017-11-22
   âœ… Processed: Paul Axel Walter - 22/11/2017
Parsed UK date: 23/10/2017 â†’ 2017-10-23
   âœ… Processed: Merrill Lynch International - 23/10/2017
Parsed UK date: 17/10/2017 â†’ 2017-10-17
   âœ… Processed: Rio Tinto Plc - 17/10/2017
Parsed UK date: 12/10/2017 â†’ 2017-10-12
   âœ… Processed: Mrs Colette Chiesa - 12/10/2017
Parsed UK date: 05/10/2017 â†’ 2017-10-05
   âœ… Processed: Clive John Rosier - 05/10/2017
Parsed UK date: 19/09/2017 â†’ 2017-09-19
   âœ… Processed: Charles Palmer - 19/09/2017
Parsed UK date: 14/07/2017 â†’ 2017-07-14
   âœ… Processed: David Samuel Watters - 14/07/2017
Parsed UK date: 07/04/2017 â†’ 2017-04-07
   âœ… Processed: Lukhvir Thind - 07/04/2017
Parsed UK date: 07/04/2017 â†’ 2017-04-07
   âœ… Processed: Niall Oâ€™Kelly - 07/04/2017
Parsed UK date: 30/3/2017 â†’ 2017-03-30
   âœ… Processed: Christopher Niehaus - 30/3/2017
Parsed UK date: 31/1/2017 â†’ 2017-01-31
   âœ… Processed: Deutsche Bank AG - 31/1/2017
   ğŸ“‹ Found 13 fines via structured page for 2017
âœ… Year 2017 completed: 13 fines found, 13 new
ğŸ“… Scraping year 2018...
   ğŸ“‹ Attempting structured scraping for 2018...
   ğŸ“‹ Trying FCA enforcement actions page for 2018...
   ğŸ” Accessing enforcement actions: https://www.fca.org.uk/news/news-stories/2018-fines
   ğŸ“Š Extracted 15 entries from table
Parsed UK date: 19/12/2018 â†’ 2018-12-19
   âœ… Processed: Santander UK plc - 19/12/2018
Parsed UK date: 14/12/2018 â†’ 2018-12-14
   âœ… Processed: Angela Burns - 14/12/2018
Parsed UK date: 30/10/2018 â†’ 2018-10-30
   âœ… Processed: Liberty Mutual Insurance Europe SE - 30/10/2018
Parsed UK date: 01/10/2018 â†’ 2018-10-01
   âœ… Processed: Tesco Personal Finance plc - 01/10/2018
Parsed UK date: 20/09/2018 â†’ 2018-09-20
   âœ… Processed: Alistair Rae Burns - 20/09/2018
Parsed UK date: 30/08/2018 â†’ 2018-08-30
   âœ… Processed: John Lawrence Radford - 30/08/2018
Parsed UK date: 30/08/2018 â†’ 2018-08-30
   âœ… Processed: One Call Insurance Services Limited - 30/08/2018
Parsed UK date: 08/06/2018 â†’ 2018-06-08
   âœ… Processed: Darren Colvin Cummings - 08/06/2018
Parsed UK date: 06/06/2018 â†’ 2018-06-06
   âœ… Processed: Canara Bank - 06/06/2018
Parsed UK date: 11/05/2018 â†’ 2018-05-11
   âœ… Processed: James Edward Staley - 11/05/2018
Parsed UK date: 26/03/2018 â†’ 2018-03-26
   âœ… Processed: Alexander David Osborne Stuart - 26/03/2018
Parsed UK date: 05/03/2018 â†’ 2018-03-05
   âœ… Processed: Guillaume Adolph - 05/03/2018
Parsed UK date: 27/02/2018 â†’ 2018-02-27
   âœ… Processed: Vanquis Bank Limited - 27/02/2018
Parsed UK date: 25/01/2018 â†’ 2018-01-25
   âœ… Processed: Interactive Brokers (UK) Limited - 25/01/2018
Parsed UK date: 08/01/2018 â†’ 2018-01-08
   âœ… Processed: Neil Danziger - 08/01/2018
   ğŸ“‹ Found 15 fines via structured page for 2018
âœ… Year 2018 completed: 15 fines found, 15 new
ğŸ“… Scraping year 2019...
   ğŸ“‹ Attempting structured scraping for 2019...
   ğŸ“‹ Trying FCA enforcement actions page for 2019...
   ğŸ” Accessing enforcement actions: https://www.fca.org.uk/news/news-stories/2019-fines
   ğŸ“Š Extracted 21 entries from table
Parsed UK date: 20/12/2019 â†’ 2019-12-20
   âœ… Processed: Kevin Gorman - 20/12/2019
Parsed UK date: 17/12/2019 â†’ 2019-12-17
   âœ… Processed: Professional Personal Claims Limited - 17/12/2019
Parsed UK date: 18/11/2019 â†’ 2019-11-18
   âœ… Processed: Henderson Investment Funds Limited - 18/11/2019
Parsed UK date: 11/10/2019 â†’ 2019-10-11
   âœ… Processed: Tullet Prebon (Europe) Limited - 11/10/2019
Parsed UK date: 30/09/2019 â†’ 2019-09-30
   âœ… Processed: The Prudential Assurance Company Limited - 30/09/2019
Parsed UK date: 25/07/2019 â†’ 2019-07-25
   âœ… Processed: Cathay International Holding Limited - 25/07/2019
Parsed UK date: 25/07/2019 â†’ 2019-07-25
   âœ… Processed: Jin-Yi Lee - 25/07/2019
Parsed UK date: 25/07/2019 â†’ 2019-07-25
   âœ… Processed: Eric Ka Chi Siu - 25/07/2019
Parsed UK date: 23/07/2019 â†’ 2019-07-23
   âœ… Processed: Standard Life Assurance Limited - 23/07/2019
Parsed UK date: 21/06/2019 â†’ 2019-06-21
   âœ… Processed: Bank of Scotland plc - 21/06/2019
Parsed UK date: 30/05/2019 â†’ 2019-05-30
   âœ… Processed: R.Raphael & Sons plc - 30/05/2019
Parsed UK date: 29/04/2019 â†’ 2019-04-29
   âœ… Processed: Linear Investments Limited - 29/04/2019
Parsed UK date: 09/04/2019 â†’ 2019-04-09
   âœ… Processed: Standard Chartered Bank - 09/04/2019
Parsed UK date: 28/03/2019 â†’ 2019-03-28
   âœ… Processed: Goldman Sachs International - 28/03/2019
Parsed UK date: 19/03/2019 â†’ 2019-03-19
   âœ… Processed: UBSÂ AG - 19/03/2019
Parsed UK date: 13/03/2019 â†’ 2019-03-13
   âœ… Processed: The Carphone Warehouse - 13/03/2019
Parsed UK date: 21/02/2019 â†’ 2019-02-21
   âœ… Processed: Hargreave Hale Limited - 21/02/2019
Parsed UK date: 21/02/2019 â†’ 2019-02-21
   âœ… Processed: River & Mercantile Asset Management LLP - 21/02/2019
Parsed UK date: 05/02/2019 â†’ 2019-02-05
   âœ… Processed: Paul Stephany - 05/02/2019
Parsed UK date: 16/01/2019 â†’ 2019-01-16
   âœ… Processed: Stewart Owen Ford - 16/01/2019
Parsed UK date: 16/01/2019 â†’ 2019-01-16
   âœ… Processed: Mark John Owen - 16/01/2019
   ğŸ“‹ Found 21 fines via structured page for 2019
âœ… Year 2019 completed: 21 fines found, 21 new
ğŸ“… Scraping year 2020...
   ğŸ“‹ Attempting structured scraping for 2020...
   ğŸ“‹ Trying FCA enforcement actions page for 2020...
   ğŸ” Accessing enforcement actions: https://www.fca.org.uk/news/news-stories/2020-fines
   ğŸ“Š Extracted 11 entries from table
Parsed UK date: 21/12/2020 â†’ 2020-12-21
   âœ… Processed: Charles Schwab UK Limited - 21/12/2020
Parsed UK date: 15/12/2020 â†’ 2020-12-15
   âœ… Processed: Corrado Abbattista - 15/12/2020
Parsed UK date: 15/12/2020 â†’ 2020-12-15
   âœ… Processed: Barclays Bank UK PLC, Barclays Bank PLC, Clydesdale Financial Services Limited - 15/12/2020
Parsed UK date: 10/12/2020 â†’ 2020-12-10
   âœ… Processed: LJ Financial Planning Ltd - 10/12/2020
Parsed UK date: 23/11/2020 â†’ 2020-11-23
   âœ… Processed: TFS-ICAP Limited - 23/11/2020
Parsed UK date: 22/10/2020 â†’ 2020-10-22
   âœ… Processed: Goldman Sachs International - 22/10/2020
Parsed UK date: 14/10/2020 â†’ 2020-10-14
   âœ… Processed: Asia Research and Capital Management Ltd - 14/10/2020
Parsed UK date: 17/06/2020 â†’ 2020-06-17
   âœ… Processed: Commerzbank AG - 17/06/2020
Parsed UK date: 11/06/2020 â†’ 2020-06-11
   âœ… Processed: Lloyds Bank Plc, Bank of Scotland Plc and The Mortgage Business Plc - 11/06/2020
Parsed UK date: 17/02/2020 â†’ 2020-02-17
   âœ… Processed: Moneybarn Limited - 17/02/2020
Parsed UK date: 21/01/2020 â†’ 2020-01-21
   âœ… Processed: Hall and Hanley Limited (HHL) - 21/01/2020
   ğŸ“‹ Found 11 fines via structured page for 2020
âœ… Year 2020 completed: 11 fines found, 11 new
ğŸ“… Scraping year 2021...
   ğŸ“‹ Attempting structured scraping for 2021...
   ğŸ“‹ Trying FCA enforcement actions page for 2021...
   ğŸ” Accessing enforcement actions: https://www.fca.org.uk/news/news-stories/2021-fines
   ğŸ“Š Extracted 10 entries from table
Parsed UK date: 17/12/2021 â†’ 2021-12-17
   âœ… Processed: HSBC Bank plc - 17/12/2021
Parsed UK date: 13/12/2021 â†’ 2021-12-13
   âœ… Processed: National Westminster Bank Plc - 13/12/2021
Parsed UK date: 12/11/2021 â†’ 2021-11-12
   âœ… Processed: Sunrise Brokers LLP - 12/11/2021
Parsed UK date: 19/10/2021 â†’ 2021-10-19
   âœ… Processed: Credit Suisse International, Credit Suisse Securities (Europe) Ltd, and Credit Suisse AG - 19/10/2021
Parsed UK date: 11/10/2021 â†’ 2021-10-11
   âœ… Processed: Omar Hussein - 11/10/2021
Parsed UK date: 08/07/2021 â†’ 2021-07-08
   âœ… Processed: Lloyds Bank General Insurance Limited, St Andrewâ€™s Insurance Plc, Lloyds Bank Insurance Services Limited and Halifax General Insurance Services Limited - 08/07/2021
Parsed UK date: 28/06/2021 â†’ 2021-06-28
   âœ… Processed: Crosfill and Archer Claims Limited - 28/06/2021
Parsed UK date: 06/05/2021 â†’ 2021-05-06
   âœ… Processed: Sapien Capital Limited - 06/05/2021
Parsed UK date: 15/04/2021 â†’ 2021-04-15
   âœ… Processed: Simon John Varley - 15/04/2021
Parsed UK date: 04/03/2021 â†’ 2021-03-04
   âœ… Processed: Adrian Horn - 04/03/2021
   ğŸ“‹ Found 10 fines via structured page for 2021
âœ… Year 2021 completed: 10 fines found, 10 new
ğŸ“… Scraping year 2022...
   ğŸ“‹ Attempting structured scraping for 2022...
   ğŸ“‹ Trying FCA enforcement actions page for 2022...
   ğŸ” Accessing enforcement actions: https://www.fca.org.uk/news/news-stories/2022-fines
   ğŸ“Š Extracted 26 entries from table
Parsed UK date: 20/12/2022 â†’ 2022-12-20
   âœ… Processed: TSB Bank Plc - 20/12/2022
Parsed UK date: 12/12/2022 â†’ 2022-12-12
   âœ… Processed: Metro Bank Plc - 12/12/2022
Parsed UK date: 08/12/2022 â†’ 2022-12-08
   âœ… Processed: Santander UK Plc - 08/12/2022
Parsed UK date: 07/12/2022 â†’ 2022-12-07
   âœ… Processed: BGC Brokers LP, GFI Securities Limited and GFI Brokers Limited - 07/12/2022
Parsed UK date: 01/12/2022 â†’ 2022-12-01
   âœ… Processed: Pembrokeshire Mortgage Centre Limited - 01/12/2022
No date text provided, using fallback: 2022-01-01
   âœ… Processed: Gatehouse Bank plc - 12/10/22
Parsed UK date: 04/10/2022 â†’ 2022-10-04
   âœ… Processed: Sigma Broking Limited - 04/10/2022
Parsed UK date: 04/10/2022 â†’ 2022-10-04
   âœ… Processed: Matthew Kent - 04/10/2022
Parsed UK date: 04/10/2022 â†’ 2022-10-04
   âœ… Processed: Stephen Tomlin - 04/10/2022
Parsed UK date: 04/10/2022 â†’ 2022-10-04
   âœ… Processed: Simon Tyson - 04/10/2022
Parsed UK date: 19/08/2022 â†’ 2022-08-19
   âœ… Processed: Citigroup Global Markets Limited - 19/08/2022
Parsed UK date: 05/08/2022 â†’ 2022-08-05
   âœ… Processed: Sir Christopher Gent - 05/08/2022
Parsed UK date: 15/07/2022 â†’ 2022-07-15
   âœ… Processed: The TJM Partnership Limited (Formerly known as Neovision Global Capital Limited) (In Liquidation) - 15/07/2022
Parsed UK date: 23/06/2022 â†’ 2022-06-23
   âœ… Processed: Ghana International Bank Plc - 23/06/2022
Parsed UK date: 16/06/2022 â†’ 2022-06-16
   âœ… Processed: JLT Specialty Limited - 16/06/2022
Parsed UK date: 09/06/2022 â†’ 2022-06-09
   âœ… Processed: TFS Loans Limited (in administration) - 09/06/2022
Parsed UK date: 16/05/2022 â†’ 2022-05-16
   âœ… Processed: Andrew Mark Thomas Page - 16/05/2022
Parsed UK date: 16/05/2022 â†’ 2022-05-16
   âœ… Processed: Aiden Henderson - 16/05/2022
Parsed UK date: 16/05/2022 â†’ 2022-05-16
   âœ… Processed: Thomas Henry Ward - 16/05/2022
Parsed UK date: 16/05/2022 â†’ 2022-05-16
   âœ… Processed: Robert Ward - 16/05/2022
Parsed UK date: 16/05/2022 â†’ 2022-05-16
   âœ… Processed: William Mark Tristan Freer (Tristan Freer) - 16/05/2022
Parsed UK date: 16/05/2022 â†’ 2022-05-16
   âœ… Processed: Bank House Investment Management Limited (in liquidation) - 16/05/2022
Parsed UK date: 29/03/2022 â†’ 2022-03-29
   âœ… Processed: Timothy Haywood - 29/03/2022
Parsed UK date: 29/03/2022 â†’ 2022-03-29
   âœ… Processed: GAMÂ International - 29/03/2022
Parsed UK date: 28/02/2022 â†’ 2022-02-28
   âœ… Processed: Barclays Bank plc - 28/02/2022
Parsed UK date: 10/02/2022 â†’ 2022-02-10
   âœ… Processed: Julius Baer International Limited - 10/02/2022
   ğŸ“‹ Found 26 fines via structured page for 2022
Error saving fine: error: null value in column "date_issued" of relation "fca_fines" violates not-null constraint
    at /Users/adeomosanya/Documents/horizon-scanner-backend/node_modules/pg-pool/index.js:45:11
    at process.processTicksAndRejections (node:internal/process/task_queues:105:5)
    at async ServiceClass.saveFine (/Users/adeomosanya/Documents/horizon-scanner-backend/src/services/fcaFines/database.js:58:22)
    at async ServiceClass.scrapeYear (/Users/adeomosanya/Documents/horizon-scanner-backend/src/services/fcaFines/orchestrator.js:83:25)
    at async ServiceClass.startScraping (/Users/adeomosanya/Documents/horizon-scanner-backend/src/services/fcaFines/orchestrator.js:25:31)
    at async rescrapeAll (/Users/adeomosanya/Documents/horizon-scanner-backend/rescrape-all-fca-data.js:32:20) {
  length: 739,
  severity: 'ERROR',
  code: '23502',
  detail: 'Failing row contains (599, FCA-2022-006, null, Gatehouse Bank plc, 12.00, 12/10/22, GBP, This Decision Notice refers to breaches of the Money Laundering ..., null, null, null, "[\\"Anti-Money Laundering\\",\\"Financial Crime\\"]", null, null, https://www.fca.org.uk/publication/decision-notices/gatehouse-ba..., null, null, 2022, 6, 2, null, null, f, f, f, null, null, {"firm":"Gatehouse Bank plc","dateText":"","amountText":"12/10/2..., https://www.fca.org.uk/news/news-stories/2022-fines, 2025-11-03 13:23:14.912836, 2025-11-03 13:23:14.912836, f, pending).',
  hint: undefined,
  position: undefined,
  internalPosition: undefined,
  internalQuery: undefined,
  where: undefined,
  schema: 'public',
  table: 'fca_fines',
  column: 'date_issued',
  dataType: undefined,
  constraint: undefined,
  file: 'execMain.c',
  line: '1997',
  routine: 'ExecConstraints'
}
âŒ Error scraping year 2022: null value in column "date_issued" of relation "fca_fines" violates not-null constraint
ğŸ“… Scraping year 2023...
   ğŸ“‹ Attempting structured scraping for 2023...
   ğŸ“‹ Trying FCA enforcement actions page for 2023...
   ğŸ” Accessing enforcement actions: https://www.fca.org.uk/news/news-stories/2023-fines
   ğŸ“Š Extracted 12 entries from table
Parsed UK date: 30/11/2023 â†’ 2023-11-30
   âœ… Processed: Dollar East (International Travel & Money Transfer) Ltd - 30/11/2023
Parsed UK date: 30/11/2023 â†’ 2023-11-30
   âœ… Processed: Hafiz Bros Travel & Money Transfer Limited - 30/11/2023
Parsed UK date: 30/11/2023 â†’ 2023-11-30
   âœ… Processed: LCC Trans-Sending Limited - 30/11/2023
Parsed UK date: 13/10/2023 â†’ 2023-10-13
   âœ… Processed: Equifax Limited - 13/10/2023
Parsed UK date: 02/10/2023 â†’ 2023-10-02
   âœ… Processed: ADM Investor Services International Limited - 02/10/2023
Parsed UK date: 28/09/2023 â†’ 2023-09-28
   âœ… Processed: Andrew John Deeney - 28/09/2023
Parsed UK date: 13/07/2023 â†’ 2023-07-13
   âœ… Processed: Bastion Capital London Limited - 13/07/2023
Parsed UK date: 04/07/2023 â†’ 2023-07-04
   âœ… Processed: Paul Steel - 04/07/2023
Parsed UK date: 26/06/2023 â†’ 2023-06-26
   âœ… Processed: Mark Antony Abley - 26/06/2023
Parsed UK date: 05/06/2023 â†’ 2023-06-05
   âœ… Processed: ED&F Man Capital Markets Ltd - 05/06/2023
Parsed UK date: 11/01/2023 â†’ 2023-01-11
   âœ… Processed: Al Rayan Bank PLC - 11/01/2023
Parsed UK date: 10/01/2023 â†’ 2023-01-10
   âœ… Processed: Guaranty Trust Bank (UK) Limited (GT Bank) - 10/01/2023
   ğŸ“‹ Found 12 fines via structured page for 2023
âœ… Year 2023 completed: 12 fines found, 12 new
ğŸ“… Scraping year 2024...
   ğŸ“‹ Attempting structured scraping for 2024...
   ğŸ“‹ Trying FCA enforcement actions page for 2024...
   ğŸ” Accessing enforcement actions: https://www.fca.org.uk/news/news-stories/2024-fines
   ğŸ“Š Extracted 27 entries from table
Parsed UK date: 28/11/2024 â†’ 2024-11-28
   âœ… Processed: Philip Pryke - 28/11/2024
Parsed UK date: 26/11/2024 â†’ 2024-11-26
   âœ… Processed: AndrÃ¡s SebÅ‘k - 26/11/2024
Parsed UK date: 25/11/2024 â†’ 2024-11-25
   âœ… Processed: Barclays Bank plc - 25/11/2024
Parsed UK date: 25/11/2024 â†’ 2024-11-25
   âœ… Processed: Barclays plc - 25/11/2024
Parsed UK date: 18/11/2024 â†’ 2024-11-18
   âœ… Processed: Macquarie Bank Limited - London Branch - 18/11/2024
Parsed UK date: 14/11/2024 â†’ 2024-11-14
   âœ… Processed: Craig Buchan - 14/11/2024
Parsed UK date: 14/11/2024 â†’ 2024-11-14
   âœ… Processed: Martin Paul Cooke - 14/11/2024
Parsed UK date: 12/11/2024 â†’ 2024-11-12
   âœ… Processed: Metro Bank plc - 12/11/2024
Parsed UK date: 11/11/2024 â†’ 2024-11-11
   âœ… Processed: Leigh Mackey - 11/11/2024
Parsed UK date: 27/10/2024 â†’ 2024-10-27
   âœ… Processed: Kristo KÃ¤Ã¤rmann - 27/10/2024
Parsed UK date: 21/10/2024 â†’ 2024-10-21
   âœ… Processed: Volkswagen Financial Services (UK) Limited - 21/10/2024
Parsed UK date: 9/10/2024 â†’ 2024-10-09
   âœ… Processed: TSB Bank plc - 9/10/2024
Parsed UK date: 27/09/2024 â†’ 2024-09-27
   âœ… Processed: Starling Bank Limited - 27/09/2024
Parsed UK date: 30/08/2024 â†’ 2024-08-30
   âœ… Processed: Alec John Cuthbert - 30/08/2024
Parsed UK date: 16/08/2024 â†’ 2024-08-16
   âœ… Processed: PricewaterhouseCoopers LLP - 16/08/2024
Parsed UK date: 14/08/2024 â†’ 2024-08-14
   âœ… Processed: Martin Christopher Sarl - 14/08/2024
Parsed UK date: 9/08/2024 â†’ 2024-08-09
   âœ… Processed: Forex TB Limited - 9/08/2024
Parsed UK date: 26/07/2024 â†’ 2024-07-26
   âœ… Processed: Anthony Dale Cuming - 26/07/2024
Parsed UK date: 26/07/2024 â†’ 2024-07-26
   âœ… Processed: Steven Harbinder Singh Sahota - 26/07/2024
Parsed UK date: 26/07/2024 â†’ 2024-07-26
   âœ… Processed: Kyle Anthony Jones - 26/07/2024
Parsed UK date: 23/07/2024 â†’ 2024-07-23
   âœ… Processed: CB Payments Limited - 23/07/2024
Parsed UK date: 19/06/2024 â†’ 2024-06-19
   âœ… Processed: Kulvir Virk - 19/06/2024
Parsed UK date: 23/05/2024 â†’ 2024-05-23
   âœ… Processed: HSBC UK Bank plc, HSBC Bank plc, and Marks and Spencer Financial Services plc - 23/05/2024
Parsed UK date: 17/05/2024 â†’ 2024-05-17
   âœ… Processed: Citigroup Global Markets Ltd - 17/05/2024
Parsed UK date: 22/04/2024 â†’ 2024-04-22
   âœ… Processed: James William Edward Lewis - 22/04/2024
Parsed UK date: 11/03/2024 â†’ 2024-03-11
   âœ… Processed: Inspirational Financial Management Ltd (in administration) - 11/03/2024
Parsed UK date: 13/02/2024 â†’ 2024-02-13
   âœ… Processed: Floris Jakobus Huisamen - 13/02/2024
   ğŸ“‹ Found 27 fines via structured page for 2024
âœ… Year 2024 completed: 27 fines found, 27 new
ğŸ“… Scraping year 2025...
   ğŸ“‹ Attempting structured scraping for 2025...
   ğŸ“‹ Trying FCA enforcement actions page for 2025...
   ğŸ” Accessing enforcement actions: https://www.fca.org.uk/news/news-stories/2025-fines
   ğŸ“Š Extracted 18 entries from table
Parsed UK date: 5/08/2025 â†’ 2025-08-05
   âœ… Processed: Poojan Sheth - 5/08/2025
Parsed UK date: 5/08/2025 â†’ 2025-08-05
   âœ… Processed: Jorge Lopez Gonzalez - 5/08/2025
Parsed UK date: 5/08/2025 â†’ 2025-08-05
   âœ… Processed: Diego Urra - 5/08/2025
Parsed UK date: 29/07/2025 â†’ 2025-07-29
   âœ… Processed: Sigma Broking Limited - 29/07/2025
Parsed UK date: 25/07/2025 â†’ 2025-07-25
   âœ… Processed: Jean-Noel Alba - 25/07/2025
Parsed UK date: 23/07/2025 â†’ 2025-07-23
   âœ… Processed: James Edward Staley - 23/07/2025
Parsed UK date: 14/07/2025 â†’ 2025-07-14
   âœ… Processed: Barclays Bank UK plc - 14/07/2025
Parsed UK date: 14/07/2025 â†’ 2025-07-14
   âœ… Processed: Barclays Bank plc - 14/07/2025
Parsed UK date: 10/07/2025 â†’ 2025-07-10
   âœ… Processed: Markos Theodosi Markou - 10/07/2025
Parsed UK date: 8/07/2025 â†’ 2025-07-08
   âœ… Processed: Monzo Bank Limited - 8/07/2025
Parsed UK date: 2/07/2025 â†’ 2025-07-02
   âœ… Processed: Craig Donaldson - 2/07/2025
Parsed UK date: 2/07/2025 â†’ 2025-07-02
   âœ… Processed: David Arden - 2/07/2025
Parsed UK date: 30/05/2025 â†’ 2025-05-30
   âœ… Processed: Toni Fox - 30/05/2025
Parsed UK date: 30/05/2025 â†’ 2025-05-30
   âœ… Processed: David Brian Price - 30/05/2025
Parsed UK date: 20/03/2025 â†’ 2025-03-20
   âœ… Processed: The London Metal Exchange (RIE) - 20/03/2025
Parsed UK date: 17/02/2025 â†’ 2025-02-17
   âœ… Processed: Mako Financial Markets Partnership LLP - 17/02/2025
Parsed UK date: 27/01/2025 â†’ 2025-01-27
   âœ… Processed: Infinox Capital Limited - 27/01/2025
Parsed UK date: 9/01/2025 â†’ 2025-01-09
   âœ… Processed: Arian Financial LLP - 9/01/2025
   ğŸ“‹ Found 18 fines via structured page for 2025
âœ… Year 2025 completed: 18 fines found, 18 new
ğŸ‰ FCA fines scraping completed!
   ğŸ“Š Total fines processed: 230
   ğŸ†• New fines added: 230
   âš ï¸ Errors encountered: 2

============================================================
âœ… Re-scraping Complete!
============================================================

Next steps:
1. Verify data quality by checking sample records
2. Update trends table (may happen automatically)
3. Test the FCA Enforcement Widget on your website


Process completed.
